author,score,body,num_replies
bumblebeetunaNZ,808,Concord looked interesting until…”5v5 pvp shooter”. I audibly groaned,27
Paradoxs,245,the robot had more soul than the other games,4
bumblebeetunaNZ,355,"So far it has been: 2 5v5 shooters, 2 vr games, a couple of souls likes, and a remaster. Pretty underwhelming",11
Will33iam,37,Why was the concord presentation so long?,1
SkyMando,115,I always psych myself out thinking it's going to be better than it is and it's always a letdown,2
Outside_Dot_5942,346,Only good thing announced was Astro Bot,3
thewitchof-el,80,So far the only real banger is Astro Bot,0
Zavier4728,44,That was definitely a State of Play that’s for sure,2
TheSignificantDong,48,"Silent Hill 2, Astro bot, Path of Exile 2 were the only things I cared about.   Maybe Dynasty Warriors if they can bring it back to their …er… origins.  Co-op fun.",1
PaleReputation1421,80,"I CANNOT wait until the PvP Fortnite COD Destiny type shit fades away, dear lord.",3
Numerous_Ticket_7628,93,Now an Until Dawn rerelease. why?! Another poor State of Play ☹️☹️,2
IndividualAd3140,127,This was the biggest L I've ever seen. ,4
Big_Liability,73,THAT WAS IT?!?!??!?!?!??!?!?!,1
gkeiser23,22,Can’t wait for silent hill and Astro bot. Definitely highlights of the show imo,2
Cottonmist,20,Wow big year for overwatch,0
Mazgazine1,9,"OMG DYANASTY WARRIORS WITH NO FOG!!!!!!!!  (I know there was a junky open worldish one that came out, but this looks like what it should be).  PS exlusive hurts but glad to see the IP is alive.",0
Big_Liability,62,can someone actually explain to me why PC ports of games are so hyped? Wasnt this a PLAYSTATION showcase? PC ports can be tweeted about. They dont need a whole ass trailer for them,13
esande2333,7,No Snake Eater!?,1
ndp1983,7,"God PlayStation has really gone down hill the last few years. Rehashed games, copies of other games ( cue concord), no original ideas coming from a company that used to harness innovation. Just a bunch of number crunching suits trying to play it safe and not take any chances.",1
Blonsky,6,Well Astro Bot looks fantastic.,1
XDAOROMANS,20,The last thing we need is an overwatch clone.. Can't see it being very successful. Crazy to think concord is coming out but factions was canceled.,1
Tetris_starship,21,"That was a load of garbage. Astro Bot looked good but that’s it. Silent Hill 2 didn’t even look that great, I was expecting a Dead Space level remake for it.",1
MasteroChieftan,23,Hey Sony uhhh....where the fuck are you?,1
candianbastard,9,Astrobot 2 let’s go,0
niooosan,4,"Of all ps titles, why remake or remaster until dawn, the original is still perfectly serviceable. It’s like remaking a telltale game, yeah cool….but why",1
Kesselrun_89,4,Quite rare to see a more disappointing event than this. Congrats Sony,0
minimalistic247,14,Only interested in Astrobot out of these. PlayStation seems to be focusing on hero shooters and remasters.,1
CrashMadz,16,So the only good thing announced was Astro Bot. Would be hyped for Silent Hill 2 if it didn’t look like a game that came out when the PS4 was made,2
Harshburitto,8,"Day 2,879 of waiting for more news on Little Devil Inside. We’re never seeing that game are we.  Edit: Spelling",3
GolfIsGood66,7,"This show bummed me out. Vr, live service...ehhh. astro will br fun but man Sony, you better bring it at the next showcase.",0
aLateSaturnsReturn,13,AstroBot and PoE 2 couch co-op? Fuck yeah this is a win for me.,0
Crashercrasher,12,State of play was giving “this could have been an email” energy,0
killaThrilla11,3,U guys actually tuned in?? Lols,0
fabris6,3,SoP was a PoS,0
licensedtoload,3,"My guess is Sony has planned to bookend the PS5 console generation with bangers, leaving the middle of the cycle for underwhelming titles and a few hits peppered in.",0
zuky211,3,Astro only nice,0
Parson1616,3,This show was dog shit. My PS5 looks like a chimney lmao. Haven’t used it in like a year or two,1
chiefrebelangel_,3,Simply awful. Who are these games for?,0
GamingRobioto,17,"Scores are anticipation rating.  - Concord - Overwatch/Fortnite clone. Why don't enemies react to being hit? Live service BS 1/5 - God of War Ragnorok - coming to PC. 2/5 - Dynasty Warrior Origins - 2/5 - Infinity Nikki - 2/5 - Ballad of Antara - looks awesome. 4/5 - Skydance's Behemoth - VR, looks cool. 3/5 - Alien Rogue Incursion - VR, cinematic short trailer - Marvel Rivals - Another crappy Overwatch/Fortnite clone. Live service BS. 1/5 - Where Winds Meet - Looks cool, but no gameplay. 3/5 - Until Dawn Remaster - Will buy on PC - 4/5 - Path of Exile 2 - Will play on PC - 4/5 - Silent Hill 2 Remake - Loved the original, but I have little faith here. 3/5 - Monster Hunter Wilds - Now we're talking. Can't wait. 30FPS, hopefully PC day one 5/5 - Astro Bot - Finally! 5/5",4
TheClimbingGecko,6,Bro why was that so short?,0
DiabeticGirthGod,15,Absolutely awful state of play. One of the worst. Should’ve just been a tweet.,1
Distinct-Shift-4094,6,"I laugh Everytime Sony says exactly what's going to be  shown in their State of Play (PC ports, atro bot and psvr2 games) , and even the leaks mention the 2 big reveal would be Astro Bot and Concord gameplay... Yet somehow people in this sub thought it would be the reveal of Ghost of Tsushima 2 or something else.   Literally every State of Play is the same thing.",1
CrushedVelvetHeaven,5,Silent hill looks like dog shit. Life is strange level facial animations. Playing it straight with the voice acting. Jank  combat look. Just what the fuck.,2
bermass86,2,That sucked so bad,0
eysan93,2,state of garbage,0
NJShadow,2,"This was so underwhelming. The only things I'm even remotely excited for are Until Dawn and Astrobot. I sure hope this wasn't their ""E3-style"" State of Play.",0
SkitZxX3,2,It was pretty bsd,0
Darkwolf1515,2,The absolute state of play,0
Only-Ad4322,2,"I’m interested in Dynasty Warriors, Infinity Nikki, Ballad of Antara, Where Winds Meet, Path of Exile 2, Silent Hill 2, Monster Hunter Wilds, and Astro Bot.",0
TriggerHappy999,2,Astro Bot / MH wilds,0
ms7398msake,2,Those 2 Overwatch clones will have their servers shut down in less than 6 months after release.,0
Crazy-Ad-3286,2,supa mid,0
Dependent_Order_7358,2,I'm just happy I couldn't watch it live. I just got to fastforward the entire event waiting for something interesting.,0
Drariestor,2,Is it possible to make an event worse?,0
BorganBits,2,"What a waste of 30 minutes, wish I'd just gone to sleep",0
haai_kaka,2,Not a great state of play,0
MikeyGwald,2,It was extremely lame,0
None,2,Concord is dead on arrival,1
AnimeGokuSolos,2,Mid,0
StevemacQ,2,Best part: Astro Bot because Team Asobi still respects legacy titles than SIE and PS Studios.  Worst part: Concord because it's a live service that embodies the worst of the MCU.  Odd part: Dynasty Warriors Origins because I hope it's at least better than DW9.,0
GioWerneck,2,"I just wanted a tease for the new AAA games from the major studios, like Santa Monica did with GOWR back in 2020: just a chilling familiar soundtrack and the logo, that’s all. Doesn’t even need to show release date or more info, just like “we are doing it”.",0
IcyChard4,2,"As I said before, this state of play doesn't offer anything major from what we want (like their exclusives). Astro Bot to me is the only major title they featured. Second only is Monster Hunter and Silent Hill 2 remake. Other than that, it is just a bunch of 3rd party titles all bundled for a 30-min show.   GOWR on PC is not even a major announcement since its just a PC port for Steam.",0
R_W0bz,2,So is that it? I miss the old days of E3 man.,0
trickman01,2,Big ol’ nothing burger.,0
Mason_DY,2,“This one was a waste of my precious remaining time.”,0
KryonikGaming1,4,No bloodborne stuff 🥲,1
44Kayz,3,I rate it 2/10,0
Normakdh,4,This was actually terrible.,0
Proof-Research-6466,3,Sony could’ve kept that and dropped Astro Bot trailer on Twitter. Can’t believe how bad this was,0
EccentricStache615,2,This SoP was the definition of “could’ve been an email”,0
ArcanaOfApocrypha,8,"As usual people set unrealistic expectations, get hyped up, then get disappointed lol",3
Outside_Dot_5942,2,I feel like Pragmata is probably cancelled at this point,0
TheSqueeman,2,"Dynasty Warriors, Silent Hill, Monster Hunter And Astro Bot where the shining stars here but real talk: I think Sony needed to show off WAY more then they did. I think the negative reaction I’ve seen floating around is warranted, the show needed some big hitters and 2 Overwatch clones ain’t it",0
DanFarrell98,2,I’d swear some of you people just don’t like video games at all,0
Tetris_starship,3,Not impressed by much so far. The Alien vr game looks good but I’m a coward and couldn’t even handle Resi 7,0
Cliper11298,3,Wtf was that? And I thought people were saying that Xbox had nothing to show? Probably more hyped for the Black Ops 6 presentation more than I was for whatever that State of Play was,0
Captain_Thor27,1,Was hoping for Phantom Blade Zero. I feel like I've been waiting for a decade for that lol. It'll come eventually.,1
XtraCrispy02,1,"When they started fighting in the Concord cinematic, I was thinking, ""This feels like a PVP trailer trying to show off the abilities.""   Why did I have to be right...",0
Pakmanjosh,1,Did the Silent Hill 2 gameplay seem off to anyone else? The animation felt really janky and the character models looked graphically mid.,1
C0unt_Ravioli,1,[Me waiting for literally any Bloodborne news](https://t3.ftcdn.net/jpg/06/14/26/00/360_F_614260035_xQp150Kr1xo895CggAK8LGstRrcnww1N.jpg),0
fullofclots,1,Astro was cool. The entirety of the show before Astro was fucking trash 🗑.  Sucks Sony dosent look at social media.,0
thenotoriousnatedogg,1,Man this wasn’t great,0
Correct_Use7569,1,I’m so happy that I don’t watch these anymore. I saw a leak and people said it had better chance than not of being accurate.  Thats all I need anymore so I know not to waste my time or get hyped for any of these events.  And it’s not reserved for Sony. Not a single one of these showcases have done it for me in probably 2+ years.,0
CourseWorried2500,1,I'm really excited for silent hill that's it,0
Bro---really,1,"This was the driest, most boring state of play I’ve ever seen. At this point, I expect the Xbox presentation to have more exciting titles for PS than this.",0
jinkinater,1,No KOTOR 😭😭😭,0
MAKincs,1,"Concord I didn’t even mind it was a 5v5 game but 15 minutes kinda dragged on. Note to my future self don’t set high expectations MGS, GOT2, RE9, or KH4🥲.",0
JustSayin20101,1,Bruh I genuinely thought that marvel game was an overwatch skin bundle or something like that. It's copy and paste holy.,0
Simple_Campaign1035,1,this was garbage.,0
PooManReturns,1,i know cinematics ain’t supposed to look like gameplay but it legit didn’t give a fps feeling at all.,0
Antler_Station,1,"Is it me, or does the head/ mouth of the behemoth in Skydance's Behemoth look really fuckin dumb?",0
badboi_5214,1,Disappointed,0
walkinginthesky,1,"Halfway through I could only describe it in 3 words: formulaic, tame, and bland. The second half had some more flavor, barely. I thought the highlight was Until Dawn, which actually looked awesome (and I don't even like horror games), and the Astro game, which looked super zany and fun.",0
trevordeal,1,Showing 2 Overwatch clones are the same time is so moronic. I don't understand who thought that was a good idea. Those games should be a year out from each other minimum.   Also... both will fail because Overwatch people aren't going to leave Overwatch just to play a different Overwatch. They aren't unique enough like something like Helldivers 2 which isn't a clone of anything.  Astro Bot will be a big success I feel and the Soulslike games will have some success and maybe one of them is really good and it gets some love from that Souls crowd but won't find the success of an Elden Ring.   Pretty low-key State of Play with too much of the same thing.,0
SprayArtist,1,State of play looks pretty grim if you ask me.,0
CarlWellsGrave,1,It's refreshing to see silent Hill kept the bad acting.,0
Coffee-and-Pizza,1,It sucked as I expected it to. Just more mediocrity from Sony. Astro Bot looks decent.,0
ItsLCGaming,1,With astro the mascot era should come back,0
KamikazeeDolphin,1,"No Twisted Metal.   No Motorstorm.  They really don't give too shits about their IT'S. Two legendary franchises adored by many, and they have shit to show for it.",0
FinesseFatale,1,MID,0
MrDeadshot82,1,"Good third part showing, incredibly bad and disappointing first party showing. Dynasty Warriors 0 was certainly my highlight because that came out of nowhere. Behemot looks very promosing. Monster Hunter Wilds is a guaranteed hit.",0
Rando_Kalrissian,1,"Cool some of these look great, I'm really looking forward to a new dynasty warriors.",0
CeruleanSea1,1,Mh pog,0
sonicfonico,1,"The show, for me, was a solid 4/10 until the end. Thanks to Astro Bot it goes up to 7/10, that game looks grrrrrreat!",0
celestialchallenger,1,correct me if I'm wrong but for this days of play they are not giving away what they say 15 games? they are just releasing access to play games for extra and premium members sooner than they would of normally. or did I miss the whole plot?,0
North_Refrigerator21,1,"Not that exciting. The two PSVR2 titles looked good though, interested in both of those.",0
burritoman88,1,I’m going to loose so many hours in Monster Hunter Wilds,0
SometimesWill,1,"So what justification is there for God of War Ragnarok, an entirely single player game, requiring PSN?",0
ascheron,1,PoE2? Yes ma'm.,0
The_Good_Mortt,1,"I think this was overall pretty wack. I loved the Monster Hunter gameplay reveal, Astrobot, and that's about it. Nothing else really moved the needle for me.   Also really frustrates me that Naughty Dog wasted all that time from 2020 - 2024 making that damn TLOU Live Service joint. I wonder how much that impacted development on their core stuff.   No Sucker Punch, no Bluepoint, no Naughty Dog, no Santa Monica (I know they just released a game and a DLC so I didn't really expect them), no new Helldivers 2 stuff, just nothing that anyone really cares about. Concord looks like 100 other games I've seen in the last 10 years.   I hope they can right this ship, and I believe in Herman Hulst. I just hope it happens sooner rather than later, because right now I'm more excited about my Nintendo Switch (an 8 year old last Gen console) than my PS5.",0
Wa_lied,1,"Is it just me who thinks """"Silent Hill 2 Remake"" is kind of a big deal ??",0
Acidz_123,1,"I feel like I'm going crazy because I thought that the State of Play wasn't bad, but I'm seeing everyone clown on it. It wasn't the best, but there were some games I'd try.",0
D1amondDude,1,"When I asked for more platformers, I really didn't have ""weeby coomer"" platformer in mind though.",0
FatLikeSnorlax_,1,Bit rough when the only good thing is Astros play room 2,0
PushThePig28,1,Silent Hill 2 will be cool. Bummed about no RE9 news and pretty much everything else except Astro looks lame,0
Fun-Cricket906,1,Awful line up this year D- showcase imo,0
SvenIdol,1,"Seldom if ever co-op, will never, ever pvp. Live service is unalive for me. But thanks for Rebirth and Stellar Blade so far this year.",0
Abyss96,1,"I swear that the situation Sony is in with a lot of their fans is similar to the Opposite Day episode of SpongeBob where he keeps playing the clarinet for that lady and she insists she’s heard enough, but he misunderstands and keeps playing.  Where’s that MediEvil II Remake? Legend of Dragoon sequel or prequel? Twisted Metal? Syphon Filter? Ape Escape? Parappa the Rapper and Um Jammer Lammy? Older fans have been asking for this stuff for forever now and Sony continues to give us the exact opposite of what we’re asking for  *edit for a thought I forgot to initially include - that Silent Hill 2 Remake trailer quite literally should have been part of the Silent Hill Transmission, the only reason it was part of State of Play was to save Sony’s ass from a complete failure",0
sadscorpion0,1,That was….atrocious lol,0
roxxas22,2,Nice pile of dog shit.,0
kaltadesmon,0,More like State of Mid.,0
Tight_Net_2886,1,Imagine buying a ps5 pro for these games,1
Nathan_McHallam,1,NON VR2 FULL LENGTH ASTROBOT GAME MY BROKE ASS CAN PLAY LESGOOOO,0
InsertObnoxiousNames,1,Was this meant to be Sony’s “big E3” replacement showcase that is meant to contend with Xbox’s on June 9th? Because it was trash if so.,0
Most-Iron6838,1,So glad I’m still waiting over here with my ps4 going through my backlog. Looks like I’ll have even more time before they release anything worthwhile to finally force me to upgrade,0
MostlyApe,1,"100% Trash. Playstation 5 is the first Sony console I've ever regretted buying. Absolute waste of a console generation. Thanks for a $580 glorified billboard machine, $80 cover fee for multiplayer and barely any games that utilize the hardware. I guess it's more fun to buy and close studios emblazoned in an industry wide war of attrition, than it is to make fun and quality games. No ones excited for more over-monetized hero shooters and live service garbage. We're disgusted. Industry suits are so out of touch with the players it's ridiculous. Absolute snooze-fest. Wake me when you return to franchises that once excited the player base...like Twisted Metal, Socom, Resistance, Bloodborne or even WipeOut. Modern gaming is so bland. Zzzzz",1
Jedden,-1,That was garbage. Not one interesting thing showed,0
bobmlord1,1,"Overall the State of Play felt short and bland to me I actually spaced out somewhere in the middle. Astrobot stood out as looking, fun, colorful and frenetic with a lot of cute nostalgic bits.    The only games I'm certain are new were that Hero Shooter (which is a genre I actively despise), Astro Bot, and that dress-up RPG thing. There may have been some other new announcements in there but I legitimately am not sure anymore.    Nice to see a (n extremely short) look at the new Monster Hunter didn't expect them to go a story-heavy cinematic direction.    I feel like graphics are getting way too homogenized I had trouble telling a lot of games apart which I believe is related to studios using the same middleware engines and not actively customizing them. I don't know how a Fantasy Dress-up RPG and a Sci-fi Hero Shooter can look the same but they do.    Side-note I'm sad to see no Ape Escape in the background costumes/references in Astro Bot Sony really has forgotten about that franchise. Edit: Actually there might be a spike hairdo in the ending shot",0
RockFox2000,1,I went in expecting nothing and got Astrobot and Behemoth out of the deal,0
dead-rex,1,I think this was in fact the WORST state of play i have ever seen. And thats saying something...,0
ZigZagBoy94,0,Concord looks like an Overwatch clone but way better than I expected. I was hoping it would be more similar to Destiny tho,0
Big_Liability,-3,"Every game so far is just rip offs of other games..... Good lord.... Overwatch clone, Soulslike clones, EVEN DIABLO CLONE",1
ItsHeadbangerG,0,"Extremely underwhelming except for Monster Hunter, and I'll be damned if I didn't jump for joy about Astro Bot!",0
Leeroy1986,0,"I enjoyed this State of Play, some good games in there I'm very excited for. Man, Astrobot has me so hyped, the first was amazing.",0
ZedGenius,0,"As a non ps5 owner, I look at those events and I do not regret sticking with my ps4. It's been 4 years guys, you can't keep living off spiderman 2, the console needs something lol",1
Killerbeth,0,"ahahah tbh this State of Play was kinda fun  I feel so bad about the developers of Concord because everyone agrees that no one asked for a game like this lmao.    The cutscene and the lore behind it made such a good impression until I saw the gameplay. I mean the game doesnt look bad at all but do we really need another PVP Hero shooter? Idk chief.   Then until dawn. The whole time I thought they were about to drop until dawn 2 but its just a remake of the old game??   You can already play the old game on the ps5 normally and its not that old that the graphics are a problem.    ~~And I was quite sure that a PC Version already exists of the game?~~ . Ok apparently there wasnt a pc version of the game. Furthermore who the fuck asked about until dawn in the last couple of years? I mean its not a bad game but just buy the original for cheap money?  This one cute anime game, I kinda missed what it even was about?    The two VR Games looked interesting for everyone who has VR. So tbf thats probably some banger titles for them.   Annnnnd last but not least the souls like games... I mean they looked good, so probably some good stuff for souls like fans. I sadly do not have the patience for such games, I really need an easy mode for souls like games.  Oh yea and if the new astro bot comes out as free to play thats definietly gonna be a 10/10 banger",0
bronymtndew,-2,incredibly uninspired.,0
GraveFox-XIII,-2,Monster Hunter Wilds and Astro Bot look phenomenal.   Everything else was very meh.,0
darkglooem,-1,Infinity Nikki is like a ripoff Alice madness returns .,0
PlatinumKingPS,0,"It wasn’t very good. Astrobot looked cool, sure. But this should just be some filler at the beginning of the show. Where are the big Sony games?",1
Geerav,0,I know I'll be downvoted by fans but PS5 games aren't as exciting as it was for PS4..,0
Tenagaaaa,0,Might just sell my ps5 and play all the exclusives on PC since they’re the better upgraded versions.,0
estrogwenyvere,0,i thought it was cool! i'm most excited for dynasty warriors!,0
dade305305,0,"As a pc player I was happy with this. As a person who just got a ps5 for a game that won't be releasing on pc, this was a major let down.   I'm still new to the ps terminology as i havent had a console since ps3 but i guess state of play is for the small throw away stuff. I'll know not pay attention to these going forward. The ""showcase"" are the big ones right?",0
Interesting_Notice84,0,"I'm calling it now. Playstation will move to mainly focusing on consoles and hardware, and Microsoft will move to focus mainly on game production and move away from hardware.",0
fr33climb,0,That was one of the worst State of Plays in recent memory. Monster Hunter was the only thing worth mentioning and GoW 2 for PC players,0
Ecstatic_Teaching906,0,Damn. I missed this.,0
Swimming-Ad-6842,0,Astro Bot was the show stealer!,0
mekisoku,0,"I don’t understand why people dislike this state of play, monster hunter and Astro bot looks amazing and those new action games seems interesting too. Also kind of surprised dynasty warriors got a new game",0
aura_enchanted,0,"Concord is valorant for idiots  Marvelwatch  is overwatch for anyone who didn't see how much of a disaster batman vigilantes was. Or their hoping you forgot.  Silent hill 2 looked like a ps4 title  Ragnarok is coming to pc and requires a psn login, and is loaded with DRM, meaning it will sell like shit as Sony seeks to artificially pump its psn numbers up with pc users since the Playstation growth has stagnated while they desperatly try and stall for the ps5pro next year  Nikki  looks like its going to be a gacha  heavy genshin impact like game, except instead of characters it will be a gear treadmill. Might be okay though  Dynasty warriors is already a dlc weighed down menace that fails horribly at monetization and as a result will be a wait till its in the bargain bin game.. again  Monster hunter wilds was a shining diamond lying in a pile of cow shit  ASTRO will either be amazing or be bargain bin  Wind and the reeds, is going to be a game I buy anyway as a shameless lover of immortal Taoist mythos games, but nobody on Playstation community is gonna give a shit about this game, and it's going to get shit canned sight unseen as overly complicated, because by its very nature traditional wuxia is overly complicated.  And that last game looked like sonys answer to new God's..  which is funny cause if your trying to compete title for title with Xbox, new gods is definitely not a high priority target",0
veryblessed123,0,"Such an embarrassing and underwhelming State of Play.  You like Live Service Games? You like Souls Likes? You like janky PC releases of Sony games? You like gritty medieval fantasy games?  Well, have we got the games for you!  Concord looks awful. Such cringe Marvel humor.",0
Only-Ad4322,0,"So I think I can explain something about this State of Play. Concord is obviously Sony’s new big game their pushing, it probably started development during the Overwatch craze and later the Battle Royale craze and, after some refinement, got to where it is today. I understand the frustration people have with yet another live service game but keep in mind, game development is long and the gaming audience’s rejection of live service is fairly recent so Sony has already sunk time and money into this project and can’t/won’t just cancel it. As for the Soulslike, there’s been an uptick in them since Elden Ring became “the thing to talk about” so to speak and won Game of the Year and again since game development started is long, a bunch of studios probably started working on their soulslike around the Elden Ring craze and so we are in a “harvest season” for them. I’d also imagine those lesser known studios think this might be their break out moment if they can make a good soulslike. That’s my interpretation at least.",0
Parson1616,0,Sony has a dog shit line up for the future.,0
Flottrooster,-4,"It's such a huge womp womp. I'm just very disappointed, Astro Bot could be cool though, but ONLY if it's like $15-20",1
