author,score,body,num_replies
None,-3,I think my ps5 is finally going to get a new life in a new home,0
DefinitelyNotAPhone,304,"What, you weren't psyched for a GotG-flavored Overwatch clone a decade too late?",9
RetzCracker,51,I knew nothing about Concord until this trailer and I was so incredibly bummed to find out it was just a PvP fps. I was like “Okay a narrative original sci fi game with fun characters let’s go!”,1
KaijinSurohm,41,"I had the exact same reaction.  It feels like such a waste to burn so much money on making that incredible intro CGI, then... Overwatch clone.",2
TheSignificantDong,40,I thought the same thing. I was like:   “this looks better than I thou- *oh.. another one of these*”,1
Starwarsnerd91,33,"They spent 10 minutes of the broadcast trying to shove it down our throats.. Stop trying to make 5v5 pvp happen, it's not going to happen",2
OZymandisR,5,There are Marvel and Star Wars overwatch clones also.   These games are like 5 years too late.,0
Sqit123,16,"When he said that, I went through the 5 stages of grief.   I normally try to be positive during these presentations, even for games I don’t care about. But this announcement had me mad as hell, because I was actually interested before they showed the gameplay.",0
FutureEditor,4,"Right? I would have loved to get to know those characters over the course of the game, but I’m not gonna keep playing this thing forever like you expect.",0
linkismydad,5,For real. I was hooked at first. If it was a single player game I woulda been interested,0
Sco0bySnax,5,I know. I’m so tired of hero shooters.,0
kaltadesmon,10,Same...,0
Objective-Aioli-1185,4,They had us in the first half,0
Alt_SWR,10,Ehhhhhh it really didn't look that interesting even before that imo. Like it's just Guardians of The Galaxy but less cool and with worse dialogue.,3
CrimKayser,4,"And then showed off Marvel Rivals, another 5v5 shooter. At least that has recognizable and believed IP. It will do alright on Marvel alone. Concord is DOA.",1
Competitive-Team5197,2,Yea same I’m definitely not getting it now,0
StankyFlanky,2,Pretty much,0
VASlim90,2,"Yep, 5 vs 5 shooter threw me off!""",0
niooosan,2,"Same, they absolutely lost me",0
Scruffy_Nerfhearder,3,"It’s from a team of FPS multiplayer vets, what did you expect?",0
Dependent_Order_7358,1,"''that's what kids like, right??''",0
jjlbateman,1,"Exactly the same, looked an interesting story then…overwatch clone ffs",0
hoochiscrazy_,1,"I could tell immediately what it was gonna be, the characters absolutely scream Overwatch... with a knock off GotG flavour",0
Angie-P,1,"same, i was hoping for a mass effect style game but more comedy.",0
kaic_87,1,"Concord lost me with the alien stuff. The first teaser made me think it was going to be a retro futuristic sci-fi game. I imagined it was going to be PvP, but something different than it was showed. Also thought it was F2P but saw the ""pre order now"" at the end so a big no for me.",0
acbadger54,1,I already have overwatch lol,1
JakeSteeleIII,1,"I liked the one dev saying they took inspiration from strategy and fighting games. No, you played Overwatch. We can see it.",0
PerfectSemiconductor,0,Really? Cause it looked like a bargain basement guardian of the galaxies with shitty writing before 5v5 pvp shooter lol,0
kadosho,52,"Honestly, true. Astro has personality, fun, and engaging. Wish the rest of the showcase had that energy",1
mitchhatesrats,21,"more soul than the soulslikes  I mean goddammit one of them was the most blatant sekiro bootleg I've ever seen, how hard is it to make something original and interesting?!?",2
Marowaksker,6,"And it’ll undoubtedly make the most use of the dual sense, I’m very interested to see what they can do with a full game with how good their demo was",0
Careless-Dentist6463,0,"We can only dream with an Astro soulslikes game, ""Astro Souls"" 👀.",0
Mean_Peen,153,Astrobot looks fun!,3
Sm00thSinceUnder00s,72,Truly one of the showcases of all time,1
AceMKV,10,Monster Hunter is definitely not a souls like lol,0
XtraCrispy02,18,"To be fair, VR Alien is pretty cool",1
despicedchilli,11,Is it over?,1
thisperson345,9,New Monster Hunter is all I care about,0
mdude7221,3,"Didn't even watch it, had no desire to watch it as I had very low expectations. You just made me want to watch it even less",1
J_Speedy306,1,And astrobot!! <3,0
LeoBorg,1,"Remaster? You mean Remake, right? Silent Hill 2. Ah, you meant Until Dawn?",0
bigmach72,1,"This encapsulates pretty much the entire gaming industry right now, not counting independent studios.",0
Charmstrongest,0,Bloodborne remaster?,2
kadosho,17,No idea. But it was way way too long,1
Correct_Use7569,20,"I almost wonder if it’s a trendy to just hate on these but then I try to look at them objectively.  It’s not just a Sony problem though. Nintendo has shit the bed multiple times, such as fucking over Metroid fans.",2
shemmegami,11,"""Expect disappointment and...""  Was it ""leaks"" that hyped you up, or personal wishes?  The only thing I was expecting was Astro Bot. The PC trailer for God of War got me excited! The ARPGs looked somewhat interesting.   Dynasty is always a letdown for me. Infinity Nikki was a meh announcement, but that just means it's not for me. Monster Hunter is also an immediate pass. Until Dawn was passed on first run and I won't pick it up now either.  The others were mixed but still positive.",1
peabody,36,"I'm looking forward to Monster Hunter, but that was already a known game release.",0
Shihai-no-akuma_,1,"I mean, Where Winds Meet looks interesting. But yeah, the collection of games there was a bit meh.",0
steasey,-12,It would be great if it was free like the first one.,4
oldravinggamer,3,Omg how stagnet have we got?,0
A_ScottishPenguin,2,One of the State of Plays of all time,0
J_Speedy306,1,I believe almost everyone is seeing it this way. After Konami presentation (after State of Play) I'm hyped to play it. Other than that? I think we have more than enough PvP games...,1
Cold_Cartoonist_19,18,You really think multiplayer pvp is gonna fade away bro?,2
Naca1227r,6,Same with every soulslike copy. It’s so damn boring..,0
Mean_Peen,-1,"Sounds like Sony is moving away from it, but this game has been worked on for awhile. It’d be a huge waste of money not to release it",0
accountnameredacted,55,Yeah as soon as it started playing I was just sitting there like “damn. We REALLY ran out of stuff huh?”,1
Big_Liability,15,Funny enough the Until Dawn remake looks worse than the one you can play on PS5 right now (I just replayed it over the weekend and it looked great),1
Wolfy-615,64,Astrobot game is literally the only interesting game mentioned,4
TheInconspicuousBIG,5,So you haven’t watched any of the game show events in the last 3 years?,1
UndeadT,1,The same day Donald Trump is found guilty of 34 counts and is now a felon running for president....this was somehow the bigger L.,0
Huge_Presentation_85,-1,What? It was a good state of play. You guys are just idiots,0
m3junmags,37,Shit was soooooo underwhelming,1
GolfIsGood66,6,Why did Silent Hill look so poor though? Isn't it a remake?,4
kudoshinichi-8211,0,I can’t help but it looks like Leon from RE4 in Silent Hill 2 remake with third person camera. It looks like generic zombie/horror shooter,0
Velocity_Rob,34,"Because Sony have nothing else to show. I mean they even had a Dynasty Warriors game in there, that’s past the bottom of the barrel.",2
FunkinDonutzz,18,"PC is a growing part of the PlayStation ecosystem, so like it or not, they will promote their PC stuff.",1
Unier,5,"First the obvious, PC players get access to them and that is a huge market. Secondly why they show trailers besides just to market it is to show that if you have powerful enough PC rig they have updated the games to have even better graphics than before.",0
drakkan133,5,"Probably because back in the day you couldn't even dream of having GOW on PC, or other PS exclusives, so they have to hype it up, even if it's not a novelty anymore.",0
DiabeticGirthGod,5,"As a PC guy it was great to see these games coming to PC, but like you said, it wasn’t a PC showcase, it was a PlayStation showcase. And judging off of that, this was terrible. 2 of the biggest announcements and they have nothing to do with PlayStation",2
Alt_SWR,1,No really that's what I'm fucking saying. They have limited time for these events and they waste half of it on a multiplayer game no one gives a fuck about and remakes/PC releases. Where's the Sony from the mid 2010s to early 2020s?!,1
Proof-Research-6466,2,Literally told my wife they could’ve tweeted that shit lmao,0
Mast3rBait3rPro,1,I kind of agree but a lot of pc only players appreciate it. I also have a gaming pc so I understand it,0
kudoshinichi-8211,1,Why they are calling as PC port when literally they work only on Windows PC and not directly on Linux or steam deck without a translation layer running a game on a platform using a translation layer is not a port,0
SometimesWill,1,Why not be hype that there’s more people you can share enjoyment of something with?,0
Limekilnlake,1,"Could be because it’s that playstation (the business unit) is showing what it’s making, rather than playstation (the console)",0
None,1,Pc has the biggest audience so why not. Also they probably needed to fill some time in the presentation as they had very little to show as usual,0
aura_enchanted,-2,"Cause if Sony wants to live on in the gaming sphere once the consoles die, they will need a foot in the door on pc.  Fact is that we are rapidly approaching an industry singularity. And Microsoft is trying to desperately hold as many cards as humanly possible to try and save the Xbox ecosystem  Nintendo just needs to cultivate their 1st parties and market it correctly and the switch 2 will probably money print like a motherfucker for them  And pc gaming is immune to industry shocks cause as long as someone wants to rub two sticks together and code a video-game pc will get games.  Simply put, Sony is the weakest link and they know it, and if they want to have any hope of publishing games once the Playstation gets shot like ol' yeller, they will need inroads to the pc market",1
Bkokane,3,Only reason I tuned in was hoping to get some release date,0
Square_Barracuda_327,1,True.. this is gaming as a whole. But Monster Hunter looks pretty fun 😊,1
kadosho,4,"I totally agree, love the atmosphere, environments, and tons of easter eggs. Cannot wait",0
Gwenevre,3,But also Marvel Rivals; that stage looks like Hanamura,0
GolfIsGood66,6,"Same, super dissapointed in Silent Hill looking like a ps4 launch title.",0
Coffee-and-Pizza,1,Hard at work on their dull as dish water sequels and remakes nobody asked for.,0
ItsLCGaming,2,Literally all sony do woth their ps4 games,0
GolfIsGood66,9,"Live service, live service,  live service",1
Butter-Chicken69,12,Yea why it look like that tho,3
Simple_Campaign1035,-1,bro it looks worse than a ps4 game.   look at re2 remake on ps4 compared to silent hill 2 remake.  I gave no idea how silent hill looks so bad.,0
gameboy716,3,  [Last upload](https://youtu.be/t_TcRcIY8a4?si=MeaeoTTUPZdm8Grl) was 3 months ago.,0
Necessary-Recipe4310,3,They released a trailer recently on their youtube page,0
PM_ME_UR_TA--TAS,2,There was an update 3 months ago.  Now as for Beyond Good And Evil 2....,0
IcyChard4,1,"Nowadays, I keep my expectations low on what SIE says. What PlayStation does is market their network and their PS Plus subscriptions. Havent' you've noticed at the end of each trailer they put this tag ""Wishlist Now""?",0
WhelpStupidUserName,5,Thanks for this. I didn’t bother watching and needed a breakdown of what I missed.,0
kudoshinichi-8211,1,"Where wind meets, Concord gameplay graphics looks like a PS4 era game the hair rendering is awful.",0
AceMKV,1,Monster Hunter will most likely be a simultaneous release on all platforms since Capcom unified title updates with Iceborne and Sunbreak(I'm coping) but otherwise it'll probably come to PC withing 6 months.,0
Mother-Lavishness-77,-10,L opinion,1
None,4,[deleted],2
zekerthedog,-2,There was a recent “leak” saying GoT2 would be announced,1
Interesting_Bridge42,4,The VA was so janky too. Hello. Sir. Why was it so stilted??,1
kadosho,1,"It was rough, thought I was seeing things. Sigh. The days of Konami making their own games is long gone. I can understand outsourcing, but maybe Bloober team wasn't the right fit.",0
IcyChard4,1,Kinda felt like they want to capitalize on the current downtrend of both Overwatch and Borderlands. Microsoft though could be planning something on their Outer Worlds IP.,0
C0unt_Ravioli,1,[I feel your pain](https://pbs.twimg.com/media/FnsMgwuaYAEtsDe.jpg),0
throwawayppddss,6,"lol i knew this was gonna be shit, even their big “showcase” they had last year was absolutely terrible so I didn’t have any expectations for a state of play",0
karate-dad,1,All I hoped for was Astrobot but I kinda hoped that it would a vr hybrid like RE4 bc psvr2 really needs some aaa fun games,0
None,-3,Is it too much to expect at least 1 big first party title? Is that not the entire reason we are buying this box in the first place,1
nazeturbine,1,Don't even get me started on Pragmata...,1
bobbyThebobbler,1,"I encourage you to watch the new 13-min video of the gameplay they’ve just released as well. It looks much better than what they showed during the showcase. I’m not sure why they edited it this way in the showcase, as it didn’t really sell the game.",0
denethortomatoes,2,Imagine buying a PS5 (me) for a decent exclusive game… played more PS games on PC than the PS5 since launch,0
PushThePig28,0,I mean PS5 is dope and has a ton of great games/exclusives but this State of Play was lame,0
ATCQ_,7,> EVEN DIABLO CLONE  Massive disservice to the best ARPG on the market lmao. Diablo 4 was a joke and POE is actually a good game.  Not exclusive though so it's not even a playstation game hahaha,1
PushThePig28,0,FF7 Rebirth? Helldivers 2?,1
Captain_Thor27,2,SoP not a Showcase.,1
Latereviews2,1,Worth 50-60 imo if it’s as good as the first one,0
SadKazoo,148,But you get to watch a new cutscene each week!!!,2
StankyFlanky,11,Then to be followed up after Marvels overwatch 😂,1
MukkyM1212,14,It’ll pair so well with Marvel Rivals! No redundancies there!,1
Velocity_Rob,6,Reminded me of the Shadowrun FPS on the 360.,1
WrongSaladBitch,6,Yaknow… I actually am because I miss Overwatch but hate what it’s become.  I’m all for this type of game. Honestly I feel like this style of game is perfect for super heroes.,0
LibertarianVoter,1,"Man, anybody with a fetish for overwatch clones with Guardians characters was in for a treat today. They got TWO of 'em!!!",0
BloomAndBreathe,1,"That game wanted so bad to be gotg, star wars and overwatch all at once.  I didn't know games could have DID until now",0
Moriartijs,1,"When every second game coming out is soulslike, evade/parry shit  no one bats an eye, we get one hero shooter from Sony and everyone loses their minds. I would love some decent alternative to Xbox franchise that might/might not go exclusive",0
Local_Nerve901,0,So should no company make 5v5 shooters anymore at all? Like I agree that it looks meh but your comment sounds like no one should make these games at all anymore,1
D1amondDude,3,"I was already down on Concord after the way they revealed it with just a title drop thinking we were supposed to care like it was ESVI or something, then loosing interest rapidly when I thought it was just going to be a rip on GotG.  When they revealed it's just an overwatch clone, my interest bottomed out.",0
Derwurld,5,"Yeah, it made it look like some co-op action adventure game aaaaand then the actual gameplay hits",1
KolbStomp,1,"I didn't watch the SoP until after it aired but I skipped every cg section. Pre-rendered videos mean Jack shit for video games 98% of the time, hook me with THE GAME then reel me in with story, characters, lore etc...",0
Moriartijs,1,for mee it feels like every game coming out is souls/eldenring/bloodborne clone. What else like this there is except Overwatch? And Overwatch now is controled by Xbox so who knows what will hapen,0
rhys0177,5,Especially weird when they killed the only example of where this worked beautifully.. Factions anyone? Idiots.,1
Tamas_F,1,"These 5v5 games have already happened. It is standard for many games including mobas in general. Don't take me wrong, I don't care for this game. But there's a reason why some companies try to push them. They are like 10 years late at least though.",0
WispyDan14,20,A playable guardians of the galaxy game where you and a team of colorful characters pull of missions and heists in space could've genuinely be good if it wasn't a boring-ass PvP overwatch clone. If it HAD to be multiplayer live service then it should've at least been PvE,0
CalvinVanDamme,1,And with gross food. Isn't this the game that featured a jiggly burger in their previous trailer?,0
kjayflo,1,"I was thinking the whole time ""I can't stand this green guy and cringe Ubisoft dialog, I hope this is at least fun....oh...""",0
Moriartijs,0,its not tho… not every game needs to be soulslike,1
topkingdededemain,-1,Over watch is fucking awful though   It’s actually smart if you make a game better than over watch. Which should not be hard,1
1spook,1,"Which is wild because it had ""Mario mixed with playstation advertisement"" energy",0
howmanyavengers,16,"Honest to god, man.  Every single ""reveal"" had me saying ""why can't these developers make something even remotely appealing that doesn't look like a clone of something else?""  Concord might as well be a GotG Destiny Overwatch flavour of the week game.  Only one that is actually interesting is Astro Bot and that's very exciting. Loved Astro's Playroom!",0
fireflyry,6,It’s not but these companies are run by shareholders now and guaranteed revenue trumps the risk of original concepts every single time.  Innovation is the realm of indies now.,0
ThunderCuntNinja,30,Saved the best for last,0
DragapultOnSpeed,7,I like astrobot. But tbh I wish they made sly Cooper instead of astrobot..,1
Rhodie114,5,You know the state of Sony exclusives is dire when what’s usually the free pack-in “we have Mario at home” franchise is the highlight of their upcoming release schedule.,1
Ok_Buffalo6474,19,Thankfully it’s a state of play not a showcase /s,0
jdemonify,1,Lol if o KY the Framerate and animations are fixed to release. It was barely 12fps,1
Outside_Dot_5942,-5,Nope,1
Correct_Use7569,-1,"My time of being an avid gamer has come and gone.  As always, I’m pumped for those who got shit they wanted or those who are excited.  Unfortunately I doubt I’ll ever see a Parasite Eve Remake, a Vagrant Story Remake and sequel, or a true Chrono Trigger sequel.  I’m thankful I live in a world where Final Fantasy 7 Remake is happening.  I wish more games like Sea of Stars were happening which would hype me more.  But the industry just ain’t for me anymore.",0
Silent-Breakfast-906,15,"Nope, they remastered Until dawn.",0
GhandisFlipFlop,2,"No , but Jason Bloodbourne looks good",0
Will33iam,15,"It was 12 minutes and some the entire presentation was 36 minutes, concord took up 1/3rd or the total presentation which is nuts",1
D1amondDude,1,"Nintendo showcases are the worst.  30 minutes of shovelware for a 5 second glimpse at the end of the only game people are actually interested in, but they already know it's coming so it's not even a shocking new teaser or anything.",0
CmanderShep117,1,I'll give Xbox credit their Developer direct thing has been pretty good so far.,1
problynotkevinbacon,1,"I think we just want a lineup of games to rival 1998 or 2001, but we're getting stuff that would be bargain bin at Walmart.",1
NormanCheetus,108,Sure but it's a full length game... The first game was a tech demo for the PS5.  I'll happily pay $70 for a full length Astro game. Team Asobi deserves it.  Edit: Okay I don't need to hear every dipshit naming the price they're willing to pay. I'm not literally setting the price. I don't care that you're broke.,6
djml9,3,"Technically the first 2 astro games and then 4th were free. The 3rd was a full, $50 VR game, and this is a full game sequel to that one (minus VR support, it seems).",1
Huge_Presentation_85,3,lol go play mobile games then,0
Targox,-4,"“…pre-orders opening up June 7”. Pre-orders, so not free. Edit: Why am I getting downvoted for letting this person know it won’t be free? ¯\_(ツ)_/¯",1
TheSignificantDong,0,"After watching the Konami presentation, I really hope they clean up SH2 graphically, it does NOT look like a PS5 game. It looks closer to a remaster than remake. I’m a little disappointed, but I love the game. If it stays this way I’ll pick it up on sale, if they make it better looking; instant preorder.",0
PaleReputation1421,13,"Eventually it will stop being a pipe dream of every single developer, yes.",1
ellayzee,0,Pretty delusional take. You can dislike it but the vast majority do. Not worth it to be up in arms about it. Just deal with it and ignore those games lol,1
Numerous_Ticket_7628,22,"Maybe I'm just getting old but not much of this interests me. Silent Hill, yes but I first played that 30? years ago, Astrobot yes too .Everything else just looks meh to me.",1
peabody,7,"Yeah, I don't know what it is. It seems like they redid the lighting and color, and it really changes the mood. Somehow seems worse.",0
BioPsychoSocial0,29,It looks like an absolute banger. I love a good platformer.,1
IndividualAd3140,5,Yup pretty much. Well and monster hunter (but I'm a huge fan so) ,1
chiefrebelangel_,2,"Monster Hunter fucks but I don't need a preview, I know what it's gonna be like",1
navenager,2,"I dunno, Where Winds Meet and Silent Hill 2 remake were pretty dope too. As a Marvel fan I'm not sold in Rivals, but it definitely didn't look as bad as I was expecting.  More stuff to come next week at SGF. This was a perfectly fine appetizer.",0
IndividualAd3140,1,So you just assume things? ,1
Big_Liability,27,That might have been the worst state of play for any type of system I have ever seen,1
FunkinDonutzz,20,"Because it's being made by Bloober Team, who are a garbage developer.   I'm guessing they were the cheapest developer, so Konami gave it to them.",1
gkeiser23,6,"I thought it looked fine, especially compared to the original lmao",1
ExplodingFistz,4,Animations looked unfinished imo. Graphics were a bit off too.,1
MadOrange64,1,"Yeah, Silent Hill gameplay trailer didn’t hit me like RE2 Remake did. I’ll keep an eye on it but not playing it day 1.",0
timtheringityding,5,"This year is pretty dead I believe for everyone. It seems like everyone ran out of ps5, xsx ported from ps4 and Xbox era. And now are stuck with the new games for this gen that won't be released until 2025-2026",1
saw-it,-2,That was one of the most generic shit I've ever seen,0
MrHorns7,-1,But we’re console gamers!,1
GeeXTaR,5,"You're right, its a playstation showcase. Not a PS4/5 Showcase. Playstation is a multiplatform brand now. Its PC games are developed and published under playstation. So it does make sense to announce it during playstations state of play.",0
Packin-heat,1,State Of Play*,0
WebHead1287,4,I mean they were really hoping you’d give a fuck about the multiplayer game,0
Packin-heat,3,Your stupidity is hilarious.,0
ndp1983,1,"True. I worked for PlayStation for 10 years Nd saw the decline of creativity and innovation. Not driven by the developers and creatives but by playstation suits. I understand leveraging large of amounts of cash is risky in the game business, especially at high interest rates. They hemorrhage cash making games and don’t make any back till they sell a copy. But as a whole saw PlayStation trying to get farther away from supporting developers.",1
spendouk23,2,"This is the unfortunate jet stream of Jim Ryan’s legacy, think we’re going to have a few more of these left in the pipeline before we get back on track with the next gen console.    Honestly man, this generation has been so underwhelming.  We’ve had some decent titles, but compared to the PS4 it’s been very lacklustre, feels like a step backwards.",0
GolfIsGood66,5,Right? Wtf,0
Sm00thSinceUnder00s,5,The real horror is the game’s graphics,0
Simple_Campaign1035,0,because it's a konami IP and they don't care.,0
CertainJaguar2316,2,Basically every single person's opinion.   This showcase was absolute trash.,1
h4p3r50n1c,5,Why do you care about upvotes?,1
BabyJosie15,-2,preach. this console generation is probably the worst in history,0
Distinct-Shift-4094,3,"Then it wasn't a ""real"" leak then, right?",1
kadosho,1,That made me do a double take. Something felt off,0
PowerUser77,1,"Yes, it is too much as they specifically announced that there would be no big main first party game in this State of Play",1
Captain_Thor27,1,"😂 Yeah, that too.",0
BottAndPaid,4,Ya don't lump POE as just a diablo clone ooof,0
ZedGenius,2,"The ps5 turns 4 years old in a few months, you just listed 2 games",1
PlatinumKingPS,-1,Never said it was a showcase! 😅,1
Ok_Buffalo6474,64,That part made me laugh 😆. Like the people who play these games don’t care too much about a story.,4
jtl94,10,Honestly after the first cutscene I’d be more interested in watching the new cutscenes each week and learning more about the lore/characters than playing the game.,0
AdelaideBen,3,Whoever thought it was great marketing to pair these two in the same SoP needs to find a new vocation in life. That was a god-awful decision... especially as Concord came up a very poor second in terms of presentation/information/hype.,0
