author,score,body,num_replies
GrampaGael69,9,I was waiting after like dynasty warriors for it be like “the new competitive 5v5 shooter” lmaoooo,1
TwizzledAndSizzled,2,That game was AMAZING.,0
DefinitelyNotAPhone,1,"5v5 hero shooters are an oversaturated market already, and are a genre where only a handful of big players can operate at one time because they demand time sinks from their players. The fact that this SoP had *two* shown in a thirty minute window is hilarious, because that means that *two* studios managed to make the worst decision for a game design they could've.",1
MadShadowX,5,"It would have been smarter if they before hand mentioned it was going to be a PvP game.    The Cinematic trailer really did set the mood for an epic single player adventure. ( Or at least co-op)  Don't mind a GoTG clone, heck don't mind an Overwatch clone either but ffs don't switch and bait like this......",0
Peesncs,1,I don’t get why factions as shelved. Such a fun concept and worked beautifully. Such a waste of resources,0
CrimKayser,1,There's like 7 hero shooters on ps.,0
acbadger54,1,I still really like overwatch despite my ever growing distaste for blizzard,1
Stubrochill17,1,"For what it’s worth, Sly 1 is coming to the shop. It’s been in the premium streaming library for a while, but sometime in June it’ll be listed on the regular shop for purchase/download.",1
Mean_Peen,1,"Yeah, it seems exclusives on all fronts are lacking this gen",0
paganisrock,1,"Something seemed up with the whole state of play, a bunch of the showcases seemingly had way too low fps. I doubt the actual game runs like that, all the playtesters would be nonstop puking.",0
Numerous_Ticket_7628,18,It is now.,1
kadosho,5,They could have condensed it to a smaller bite size trailer. Neat idea with the story. Felt some Guardians of the Galaxy vibes. Then it's a PvP.,2
Correct_Use7569,1,The last Xbox I had was a 360.  I don’t follow them much but the disaster that was Kinect and the absolute trash they continued pushing with it is pretty unforgivable.  Peter Molyneux is probably the figure I despise most in video games with the constant empty promises and failure that he spouted after the fable series ran its course,0
DarkOstrava,1,"this state of play being rubbish hasn't bothered me. i just discovered Songs of Conquest, so i'll be playing that.  there are plenty of good games.",0
Correct_Use7569,32,Lmfao the edit has me laughing. “I don’t car that you’re broke.” So dead lmfao,0
ChaosRaiden,1,The first game was a VR game for PS4 👀,0
GhandisFlipFlop,-9,I would pay $40,1
Ok_Buffalo6474,-10,Man idk if I’d pay 70 tbh and I loved the first one.,0
Competitive-Team5197,-7,I doubt they would make it $70,0
anonymousss11,-17,"Just this dipshits take, your take is wrong. $70 IS too much, its not matter of being broke, I don't want to and am not spending $70 for this. Much more likely to be $40 than $70.  But again, just this broke dipshits take...",1
PowerUser77,1,"It obviously is a direct sequel to Playroom considering all the PlayStation assets in the game, this time the PlayStation characters also seem to be an integral part of the gameplay",0
TheHidestHighed,18,"""It would be great if..."" I think they were aware of that",1
Cold_Cartoonist_19,1,"Highly doubt it, multiplayer games just make so much more money than single player ever could",1
Cold_Cartoonist_19,5,Think you replied to the wrong guy,1
J_Speedy306,3,Same. I already know about Silent Hill and to be honest silent hill interception video covered the presentation much better. Astro Bot will be pre-order for me.  But I don't care about another mediocre PvP.,0
Wolfy-615,1,I prefer 3D like this over sidescrollers but yes.. looks fun af.. one of my 4 ever Platinumed games  Edit: I think they teased the PS5 Pro in the Astro trailer.. it was black with blue lighting 🤔,0
Wolfy-615,1,The fps and graphics are PS3-esque tho.. we’re in modern gen and they keep dropping these choppy games out,1
IndividualAd3140,1,Your damn right. Monster Hunter dont miss. ,0
TheInconspicuousBIG,1,Lmao there have been much worse than today’s showcase.,1
throwawayppddss,18,"state of plays always suck, they are never any good. Even last years “big” showcase was absolutely terrible, sony has been lacking",2
GolfIsGood66,3,"I didn't know that, that's infuriating.",1
GolfIsGood66,0,"I dunno man, it looked like ass to me tbh. I'll still buy it though, loved the original.",1
GolfIsGood66,2,Yeah it was weird,0
Master_Caregiver_749,2,"That's fine, really. Not every year needs to top the previous one. Also, it helps with backlog!",2
rhaesdaenys,3,I'm not a console gamer. I appreciate the PC trailers.,1
Square_Barracuda_327,2,"💯   focus has definitely switched to profit since corpos are making decisions instead of creatives like it was in the early days when it was ""games by gamers for gamers"", like Sven from Larian referenced recently.. at least for AAA titles.  quality and creativity suffers.. the market is flooded by cash grabs, but there is a niche of good games being made for the right reasons. Just takes a little more searching these days and will power to not buy the $500 skins they're putting out lol",0
Mother-Lavishness-77,-4,Until dawn is just the game no other is better except HoA  and marvel rivals looks so good,0
DiabeticGirthGod,-2,My balls + your forehead,0
zekerthedog,-2,we should have been able to decipher which leaks were real before the state of play?,1
yo_boy_dg,0,![gif](giphy|n4oKYFlAcv2AU)  I don’t understand why anyone was expecting so much when they told people this at the start of the year right? This state of play wasn’t THAT bad though.,0
PushThePig28,0,I mean you aren’t wrong about the lack of exclusives until recently. Feels like games that made the purchase worth it really just started releasing more consistently. I just got a ps5 when Spiderman 2 came out so it feels new for me still.,0
Captain_Thor27,2,"I'm aware, but they show the big name first party games in Showcases. Unfortunately, we'll probably have to wait till September.",0
SadKazoo,37,It’s just a weird fusion. I think their world building and lore has potential. I just can’t be assed to play a competitive hero shooter to see it.,2
Acidz_123,1,"Ironically, this was the one part of the trailer that intrigued me lol. The gameplay was meh, but I'm a lore/world building nerd and seeing that they put effort into expanding the lore like that got my attention. If the game's free (I doubt it will be) I'll definitely pick it up because of that. But I know that it's essentially DOA because gameplay is the most important and that part is definitely lacking.",0
Pliskin14,0,"Speak for yourself, I do. The Overwatch shorts are some of the best content there is.",0
Hesj,0,"Eh, not necessarily true. People don't play the games because of the story, but the story can be really interesting.  Easiest example is Overwatch, which I used to play quite a lot a couple years ago. The lore and story ""content"" (most of it wasn't in game but instead in comics and trailers) was quite intriguing.",0
emibost,1,"Silent hill 2, 5v5 shooter online only",0
Packin-heat,2,I think people should have realised by now there's always room for one more. Sure loads of them fail but it has been proven time and time again there's always room for another one.,0
topkingdededemain,1,Gross,0
Mean_Peen,3,"I wouldn’t be surprised they’re going to measure the popularity of these titles to weigh whether or not they should expand or remake them. Let’s face it, creativity is sorely lacking nowadays, so the idea of remaking “classics” just makes more sense. This is the perfect research platform to determine where to allocate resources, imo. We may see a few classics come back to the fold, though I’m still not going to hold my breath",0
Kaneki_The_TSM_Kami,26,I wish it finished sooner.. everything but Astro Bot was a waste of time,1
Will33iam,3,But it will probably be full of micro transactions which is no bueno for me,1
D1amondDude,2,"If they just had someone stand up and say ""It's an overwatch clone, but aesthetically it's bootleg Guardians of the Galaxy"", we would have gotten the entire picture in less than a minute.",0
mekisoku,3,Judging from the content and the quality of the previous game I would gladly pay 60,0
NormanCheetus,1,"It was an off-hand opinion. I specifically said what ""I PERSONALLY"" am willing to play. Astro's Playroom is the highest quality game on Playstation 5, so I was giving it personal praise by saying that I PERSONALLY am willing to pay a premium for it, because the game devs actually deserve the money.  >I'm a broke dipshit you're wrong I'm right my parents won't let me spend $70 from their credit card and I missed your point.  https://gbatemp.net/threads/game-prices-in-the-90s.588230/  Game prices have not risen with inflation for about 40 years. They depreciated down from $70 - $90 price tags.  Price inflation in games happened with AAA publishers putting microtransactions, battlepass and gacha mechanics in their games. So it's ironic that you've no problem being a Wuthering Waves addict.",0
anonymousss11,-1,"The proper syntax for knowing it won't be free would be ""it would have been great...""",0
PaleReputation1421,1,https://youtu.be/YPrtOO7veBE?si=0f4VTGeREspbC_BM  I’m not the only one who thinks this..,1
ellayzee,-1,Not at all. I was adding onto your comment. That’s how conversations work lol,1
IndividualAd3140,1,I feel you but what can we do brother? idiots just buy everything up no matter what.The wheel will keep spinning on the wallets of the dumb. ,1
IndividualAd3140,-3,And? It doesn't change the fact it's an L.,1
Big_Liability,5,If that's the state sony is in then it's BAD,1
ryushiblade,1,"Nintendo is the only one who almost always does well in these — inversely, the MS and Sony ones are almost always underwhelming  I’m convinced part of it is Nintendo’s adherence to pacing and order, combined with a generally good balance between first party and indie games, and a good genre spread  I love my PS5, but dear lord does Sony need a better marketing/social media department",1
FunkinDonutzz,6,Yep. The second Bloober Team were announced as the developers my hype went from one hundred to zero almost instantly.,1
gkeiser23,2,"I’ve never played the original so I don’t have much to compare it too. I loved the RE2 remake though, and it looks similar so I’m sold",0
Velocity_Rob,1,I mean you’re not wrong. I’ve been playing Persona 5 for the last month.,0
BombproofAura,0,Nice cope mongoloid,1
Big_Liability,4,PC trailers for a game that already has trailers for it's console release doesnt even make sense to me. It's the same game,2
Distinct-Shift-4094,1,"Bro, which publication did you see GOT2 was going to be revealed in the State of Play? Reddit? IGN, Gamespot, Kotaku none of these said that. They did mention Astro Bot, God of War PC, Concord, etc.",1
Ok_Buffalo6474,14,"Same. What happens if I get busy and miss a couple months? I’d probably be less interested in the story when I came back to it, would I sit through all the cutscenes or would just want to play the game and skip it all making it kinda futile.Idk I guess that’s the new way to implement story features into these games.",0
shemmegami,-1,"That's not a bad thing. I'm interested in it.  Maybe there are a lot more like yourself who would watch a monthly YouTube compilation. You're still part of the community then, just not an active participant.   What were your thoughts on the rest though? It's the most excited I've been post State of Play. The lowest points for me were probably Dynasty or Infinity Nikki.",0
Numerous_Ticket_7628,7,Yep.,0
kadosho,1,Aye. It's a feature 🤦 there are so many PvP titles out there as is.,1
JWillCHS,1,"Live service games aren't going anywhere. They will continue to evolve with the evolution of the internet. They've been around way before Neverwinter on AOL which was a paid live service. Same thing with the early days of MMORPGs like Ultima Online, Asheron's Call, and Everquest. And all that was before World of Warcraft in 2004.  Even Xbox Live to an extent was prelude to it all on the original Xbox. Back then PC gamers were like, ""who is paying to use their internet to play simple multiplayer games like Call of Duty"". What's funny is you still do that with Playstation Plus and Xbox Game Pass today!  The business model just needs to change or they need to make great live service games. And as cost increases to make AAA games you'll continue to see more of it. The larger the industry gets the more it becomes a business and the less risks they want to take. The best advice you can give to these people is AT LEAST stick to what you do best even if you have to add microtransactions. I have a feeling if the cost of making videogames continues to grow, Sony will reduce the window for when a first-party title appears on PC and I wouldn't be surprise to see future simultaneous releases. It's either that or more live service games which they announce this week that they want a bigger push for that kind of stuff to release on both PC and PS5 day 1. ![gif](emote|free_emotes_pack|facepalm)",1
Cold_Cartoonist_19,2,"Sorry man its like 2 am here, yeah multiplayer isnt going anywhere ever imo. Who doesnt like playing with their friends?",1
Wolfy-615,2,I agree that we are gamer brothers.. but THIS idiot will never buy a game that looks old gen ever again.. Dead Space ruined me on that.. clunky unupdated controls 🤢,0
TheInconspicuousBIG,2,Damn you are one pissy guy,1
Sm00thSinceUnder00s,7,"The worst thing is, this generation is the most profitable for PlayStation so they think they’re doing good…",0
throwawayppddss,1,"microsoft’s are actually usually better than sonys now adays, but they never actually end up delivering on what they promise",0
J_Speedy306,3,How shit are they? The game looked quite well while true to the original to me. Should we expect a lot of bugs?,2
Master_Caregiver_749,1,"Ok...and what's so bad about it? As far as I'm concerned, fewer games that I'm excited about mean more games I get to play from my backlog.",1
FunkinDonutzz,1,It's to promote _checks notes_ the fact it's coming to PC.   It's really not supposed to be deep.,0
npretzel02,0,"When a game is ported to PC it includes a host of new features like keyboard and mouse, ray tracing possibly, DLSS. They want to show those off",1
zekerthedog,1,"Was a Twitter post by someone named haothors, you can search this sub and see all the speculation",1
Will33iam,1,And the problem is that the market is currently over saturated with pvp micro transaction games,1
PaleReputation1421,1,True. At least stick to what you know. I feel like every developer now days is trying their hand at a “LSG”. Lame.,0
ellayzee,0,It’s good lol. Yeah I’m agreeing with you. But mainly idk why people get so upset about stuff they can’t control. Most people like this thing and you do not. Sorry but it’s gonna be popular. Just ignore it lol.,0
IndividualAd3140,1,I don't see how. Your literally the one insulting and getting on the offensive. Besides one look at your comment history shows you have bad takes and are definitely the more pissy of the pissed people lmfao.,1
SoberEnAfrique,3,"They famously have like zero actual gameplay. They excel at walking simulators with great atmosphere and jump scares, but anything related to puzzles or combat will suck (probably)",0
null591,4,"Bloober Team are notorious for making derivative horror games such as Layers of Fear, you can find a ton of videos about this going in depth as to how much they copy, they also have zero subtlety when it comes to dark subject matter so handing them Silent Hill 2 is a disasterclass from Konami.",0
BombproofAura,1,"We can just crash the whole industry and just keeps playing New Vegas and games from 15 years ago where we actually made games and not C tier movies trying to copy final fantasy the spirits within.   Mass effect trilogy was all released in a spam of 6 years, have fun ""playing"" all those new videogames lmao",1
KinoCactus,1,They don't need a whole trailer in their presentation for that. Release a separate trailer having nothing to do with the presentation.   The Until Dawn rerelease was also a waste of time.,0
Distinct-Shift-4094,1,"So, let it be a lesson for you. Next time stop using Twitter for ""real leaks."" You'll get the real one from gaming outlets. IGN, Gamespot, Eurogamer, Kotaku all of them literally said exactly what was going to be shown in the showcase.",1
kadosho,1,Indeed. It is a chaotic mess out there,0
TheInconspicuousBIG,1,Nah man cmon you gotta read. Just said there have been many worse showcases over the years in a way that went over your head I think lol,1
Master_Caregiver_749,1,"Agree to disagree then. There are plenty of new games coming. Just because you are not interested in them doesn't mean they aren't there. Big gaming companies aren't the only ones making games, you know.",0
zekerthedog,1,Can you link me to those posts?,0
IndividualAd3140,0,It's not gone over my head at all. I know what your saying. I know this ain't the first time but saying there's worse is subjective. Depends on what you like or dislike. This one for me was deffo the biggest L. ,1
TheInconspicuousBIG,0,💀,0
