author,score,body,num_replies
Whofreak555,-2,Lots of great games coming down the road. Only can think of one game that had a release date this year though. Phil loves making us wait.,0
Swifty404,-2,Xbox killed everything this year,0
sickened88,-2,What’s exclusive? Or timed exclusive? Nothing official I guess?,0
DragonflyNo2989,-2,Still no handheld announced. Oh well.,0
boredscrollingreddit,-2,So Halo not even mentioned at all this entire event lol  Crazy with Halo 2’s 20th anniversary (and MCC/2A’s 10 year anniversary) happening later this year.,0
TheJoeRulez,-8,Terrible event. These are getting worse each year!,0
patriot050,-3,i wish they would make a small show just for indies. those games just break the flow of the show IMO. i would rather have a 45 minute show of bangers than 1.5 hours with filler.,0
Tangentkoala,-2,My conspiracy theory Is that Microsoft is convincing the call of duty peeps to bundle all their add ons so they force the consumer to buy more storage space.    218 GB for COD is ridiculous. There's no way in hell am I keeping it on and letting it get to 350 GB with the addition of black ops. It's already at half my storage,0
RobertdBanks,-4,"Gears of War prequel is one of the most uninteresting concepts they could have done for the series, especially considering Judgement exists.",0
CryoJNik,-3,"As interested in some of these titles as I am, I can't ignore the precedent that they set with Tango.",0
phpArtisanMakeWeeb,-4,"I hope they fix Fable protagonist's face, she's unnecessarily ugly.",0
None,-6,[removed],1
Ok_Code_1691,-7,Nothing but cgi trash,0
barelyash,-8,I’m not gonna lie I fell asleep watching this  Not even kidding I got so bored and tired I literally slept and woke up during the black ops direct,0
DapDaGenius,34,I’m not familiar with them but that game did pique my interest,4
MisterMT,21,Very intrigued by that. Loved the setting.,0
FillionMyMind,1,"Kind of amazing that Rebellion has managed to turn around their image this much. I always remember them as the people behind Rogue Warrior, Shellshock 2, and Call of Duty: World at War - Final Fronts lol. People do love Sniper Elite tho",0
Eglwyswrw,150,People said E3 was dead. It just morphed into the Xbox Showcase.,3
Neat_Clothes_248,26,"Ive only owned ps my whole life, and I'm hoping Xbox kills it with these  Sony getting complacent",4
Jonesy_lmao,7,“Looks great / amazing”… ah I’ve fallen for that in my time. I’m at the stage where I wait for reviews or sale.,2
AlsopK,2,Yeah this was the best showcase in recent memory. BO6 being 300gb and always online even for SP is a bummer though.,1
Bad5amaritan,1,"Remember, we're buying games, not movies. Nothing the showed matters until we're playing it, and can see for ourselves.",0
Emotional-Silver-134,1,wait!? a new perfect dark game!? and stalker 2!? i never thought i would see perfect dark come back nor did i expect there to be stalker 2 after so many years since clear skies! that's amazing!,0
29092023,1,I liked doom because it was actual gameplay gears was just a cinematic,0
HMS_Sunlight,-1,"They really knocked it out of the park with this one. I think it's safe to say Xbox won the summer presentation this year, considering Sony's awful state of play and Nintendo's inevitable slow year.",1
Breezer_Pindakaas,0,While true. How many are xbox / ms exclusive and justify owning an xbox over a PS?,2
Background-Ninja-550,0,I think it's nothing special. Quite boring actually.  Looking forward to Stalker 2 a lot though.,0
bogas04,56,Fable looked basically flawless. Cut scenes and gameplay looked exactly the same in quality and so consistent.,2
Pleasant-Speed-9414,14,"Yeah I’ve been hyped for both of those since last year. Was semi hoping South of Midnight would “shadow drop” into gamepass today, but seems to be a bigger game than somewhat teased last year",0
Flat-Ad4902,19,"Unpopular opinion maybe, but South of Midnight was the game that excited me most out of the whole event.",4
DocBrutus,7,I lit up when I saw Fable. It’s my favorite game series.,1
blackamerigan,1,"Yeah it was finally, finally, finally good to see some gameplay from some of these studios... Most of what was shown is what we've seen in previous years, not that much to be excited for but I think Fable is meant to be a standout game that's why it's taking so long. Compulsion Games has some good themes and could have an indie hit on their hands with South of Midnight.  I think doom might be well-received but I personally couldn't get into doom and I just see their new game as a rebrand. Idk I didn't find any of the showcase to be that interesting but maybe I'm more into indie games, more than I am call of duty.",1
ienjoymen,1,"I am very excited for Fable, I just hope I'm able to play as a guy instead, given it's an RPG (presumably).",0
MrGino815,10,I agree. Most the talking used to be just super corny anyways. I don’t need someone to tell me about something im just about to see.,1
ADIDASinning,16,"I miss a tiny bit of talk, it helps you to digest the content. This new style of content consumption is kind of sickening, attention spans are shot and people act as if they don't have time for banter/filler.   I miss regularly programmed shows, the feeling of not being rushed, the space to talk about what I just saw rather than the bombardment that is flash-quick content.",2
Ok-fine-man,47,"We're about halfway through 2024 now. Like, when the fuck are these games announced for 2024 going to actually come out?",3
The_Green_Filter,15,"Felt really bad seeing people down on Dragon Age, glad to see some positivity!",2
Vostroyan212th,8,"Dragon age look generic as fuck, bioware is not the company it was 15 years ago",3
PoolNoodlePaladin,2,Replace Dragon Age with South of Midnight and your list is good,1
Mrbutter1822,0,"Idk about perfect dark just yet. That trailer looked cool but just didn’t feel like perfect dark to me, it felt like a whole other game franchise.   Though who knows, this could just be me being picky and this is what perfect dark is now",1
ScottSterling77,-1,Dragon Age looked great? What are you smoking?,1
LZR0,83,"My guess is to not cannibalize on the games they can actually further monetize with expansions, upgrades, MTX, battle passes, and all that.   That makes sense for CoD but all other franchises it doesn’t make sense they haven’t done staggered releases (like releasing Crash trilogy one month, Crash 4 after that and so on).",2
TheClamSlam,51,It's an easy break-glass-in-case-of-emergency game pass drop for when they have a quiet month,0
basedfelix,13,drip feed content. just like nintendo does with their nintendo online retro games,0
NuttingPenguin,24,That’s all I was hoping to hear about.  I just want the old call of dutys to have more people online.,0
anuncommontruth,12,"Someone posted a technical deep dive a while ago that seemed to make sense. I guess there's some behind the scenes stuff that needs to be worked on. I'm not sure about games like Spyro and Crash, but I think the multi-player and servers are an issue.",0
MyUltIsMyMain,3,"I'm guessing they'll start adding them slowly over time. They'd oversaturate gamepass with so many games, and each individual game won't get a lot of playtime.",0
bogas04,2,"I think it's also hard, apart from a systematically better thing to do to make more money. They usually bring games to Xbox, PC, Cloud with touch controls. The latter two are harder to get right for so many games and the Battlenet on PC makes it unnecessarily complicated like with Diablo 4. Maybe they're going to merge Xbox app and Battlenet and that's taking time, and they don't want to release things iteratively as PC and Cloud are important for first party.",0
ItsStaaaaaaaaang,1,Exactly my thought. They could have actually had something for us to play today if they put just a couple of those games up.,0
spidsnake,-1,The backward combability team was disbanded a few years ago.  It looks like their main priority is making games forward compatible with the next Xbox.,0
Imthecoolestdudeever,-2,They have dates they must wait for before they put COD games on Gamepass. It was in the ABK acquisition deal.,0
shockwave8428,6,First person uncharted haha (I get that uncharted is super inspired by Indy in the first place). I’m very pumped for this one,2
bogas04,13,I kinda like that it's a bit cut scenes heavy. Makes it more like movie + game in one go.,2
JamesIV4,1,"It felt the same for me, but I'm glad for you",0
ChaseThoseDreams,3,Same feels bro.,0
Flat-Ad4902,3,Idk why you would have expected it tbh. With that said I hope that they do open that back up one day,0
Speedstick2,1,Or another conkers game or jet force gemini or blast corps!,0
Raecino,8,Some of that was in game wasn’t it?  At least they say it’s using the in game engine for the trailer.,0
ErinLosesHerMind,3,"There’s been some talks that it’ll be around the 2025-2027 window, but a lot of insider reports have stated that development is going really well, so hopefully we’ll see it in 2025. If so, just another game to be hyped for with the absolute stack of others that come out next year.",1
shinikahn,1,All the shooting was gameplay,0
None,-5,[deleted],1
Solidsnake00901,-6,They didn't spend billions to give stuff away. Gotta make it back somehow.,2
Jiggaboy95,-1,"They don’t want to splinter the cod playerbase. What good is it doing them wasting resources on old games with little monetisation?   What did everyone think would happen when they bought Activision, that you’d all be playing BO2 like the good ol days via gamepass? Not a chance.",0
Imthecoolestdudeever,-1,The ABK deal had clauses that gave dates that would have to pass before COD games could he on the Gamepass system. Either end of 24 or early 25.,1
None,-65,[removed],1
system3601x,-5,"Since 1932...  Common man, every year there is a great one, last year with Starfield was explosive, few years ago with Series X was insane. This year was amazing too.",1
bogas04,8,"Perfect dark looked better than I hoped for. A dying light parkour esque + immersive sim lite + tactical shooter. It's familiar and different enough, but we only saw curated sections so it's best to keep expectations in check.",1
bbressman2,14,Gave me goosebumps when the piano came in with Mad World at the end of the trailer. Reminded me of the original Gears announcement trailer.,2
None,-4,[deleted],2
dewsh,6,I'm guessing 2026 release,1
RobertdBanks,-5,…but why? I don’t see the appeal of a Gears prequel (again) unless you’re just looking forward to PvP or Horde mode,3
faithOver,11,Enjoy its fantastic. GoW2 is IMO one of the greatest games of all time.  I have been replaying them on couch-coop. What a blast.,0
CompetitiveDeal498,8,You’re going to have a BLAST,0
TurnUp0rTransfer,1,I realize you meant Gears of War when I thought that God of War is also on Xbox now,0
metallica123446,22,Wanted Spyro 4,2
bbressman2,5,"From that Toys for Bob announcement, I would expect an announcement next year. Hoping it is banjo or Spyro",0
Flat-Ad4902,2,It feels like the AAA industry is stuck making the same 3 games over and over and over and over and over and over and over and over again,2
srira25,1,"Judging by this comment section and the other comment section on the Summer Game fest, seems like a lot of people want exactly this?! Just action RPGs and people are happy.",0
None,1,I'd like to see a Legend of Spyro trilogy remaster. I actually liked the two games I was able to play. The first and third one. The second one I never got to play since it wasn't BC.  ,0
Caesar_35,10,*\*Laughs in Elder Scrolls VI\**,1
Bulky-Complaint6994,1,Yeah. Feels odd. They keep updating Sea of Theives but no word on Everwild. And what is Double Fine up to these days?,0
Yeet-Dab49,1,"I remember that, I was in high school. I’m about to graduate college",0
probiz13,21,The new one will be the first apparently,1
Imthecoolestdudeever,-2,The ABK deal had clauses that gave dates that would have to pass before COD games could he on the Gamepass system. Either end of 24 or early 25.,1
DapDaGenius,9,Halo will be fine. We know they are already working on the next one.,2
FatherGabriels,4,Can’t have halo and gears,1
None,1,[deleted],1
calvinien,1,Not everything needs to be halo.,0
BaturalNoobs,-2,F,0
Pristine-Ad-2556,1,"Yeah, weeks of xbox hate for closing down studios for games that didn't sell enough to even make a profit margin. With that being said, where'd all the Phil haters go now?",0
Link__117,-4,"I hear that exact thing said about Xbox every year, yet it still continues to decline",1
Link__117,0,"That exact sentiment “we have so many good things on the horizon, just another year or two” has existed for the last 5 years with Xbox",0
pratherj23,5,"Looked amazing. Can’t wait to play, but will have to for an unspecified amount of time lol",0
Sharp-Pop335,3,its the 2nd time they remastered snake eater.,0
TTBurger88,5,A Banjo Kazooie remake could be a good AA filler game to gauge interest.   A character platformer from MS could be a good counter to Astro-Bot on PS5.,0
theyfoundty,8,If you're still hoping for banjo threeie I have bad news for you.,0
AresOneX,14,No dates for Indy and some other 2024 games is weird considering we only have 6 months left this year.,2
PurifiedVenom,9,No specific dates for 2024 games and not a lot of gameplay deep dives are my only complaints. The latter was made up for by the sheer quantity of great looking games though.   Fantastic showcase overall imo,0
flysly,18,"This exactly. Great games shown off, but no release dates says “expect delays into 2025” imo. Would’ve also loved handheld news.",2
LZR0,7,"If there’s no date locked by the devs it doesn’t make sense to date the game.   We’ve been through the same thing with Sony and other publishers, last year Insomniac devs were literally harassed to date Spider-Man 2 after it didn’t have even a month locked on May’s showcase, it was just two months later they were able to confirm the actual date.   TLDR: Let the devs do their work and ship it when ready.",1
kennerc,-6,"You summarized my thoughts.  This showcase was great, but it could've been more.",1
Imthecoolestdudeever,0,The ABK deal had clauses that gave dates that would have to pass before COD games could he on the Gamepass system. Either end of 24 or early 25.,1
Jkstatus,1,Gears 6 rumored to be launch title for next generation Xbox ,0
BudWisenheimer,2,> I thought the cylindrical design they showed in the mockups was looking good.  Agreed.  I had a 2013 MacPro on my desk for almost 10 years and I never got tired of seeing it.  Barely noticed it really.  Very low-profile and very quiet.,0
yellow_abyss,8,I wanted a new controller and waited a month lol hoping they might reveal sebile in the event. Guess gotta buy series x controller,1
AresOneX,10,I agree. It was disappointing on the hardware side.,1
boop1234567,1,Is there talks of an xbox handheld? Would it be like their version of a vita/ds or something like that or would it be more like a stream your games on the go kind of deal? ,1
doyouunderstandlife,1,"Yeah, I need to buy a new controller and have been holding off on buying a new one because I saw the leaks of the new Sebile design that was apparently going to be released around this time. Dunno what happened to it.",0
darkdeath174,8," Starfield Shattered Space also didn't get a date beyond 2024.     It is possible all 3 aren't locked in for the order they launch yet, maybe we hear dates at Gamescom.     Honestly, I'd prefer Starfield DLC be last if it means Indy isn't December.",0
CptCroissant,3,If much rather they don't date stuff and just let it bake until it's ready though. No more Starfield type releases where you need huge patches and 12 months to make it even ok,1
makersmalls,9,Definitely thought wow was coming to console for a second there,1
DonTino,5,Flight sim with competitions etc is great for me and my friends,1
Caesar_35,1,"Winter Burrow looks like it could be a neat little game. Reminded me a bit of Brothers: A Tale of Two Sons and Pentiment.  It ain't no AAAA Skull and Bones (lol), but I like the shorter stuff too.",0
Rotisseriejedi,1,Are all game coming to PC Gamer pass as well?,1
GeneralEmployee9836,2,Every time I see a Xbox showcase I keep hoping I see a WOW console port and I disappoint myself every time 😅,0
Speedstick2,0,Can't wait to play a single xbox game on ps5 doesn't prove that the xbox has a robust library of games.,0
VaishakhD,-2,Honestly in a few years? The latter option most likely,0
Plutuserix,1,"GTA is coming to Xbox as well, it's not a PlayStation exclusive.",0
Imthecoolestdudeever,0,The ABK deal had clauses that gave dates that would have to pass before COD games could he on the Gamepass system. Either end of 24 or early 25.,0
Raecino,1,"That’s just the cinematic trailer for Dragon Age, the actual game is probably a lot different from that.  Hopefully.",0
ScottyKNJ,2,Not shocked at no mid-gen refresh. I think they're gonna get a jump on the next generation and launch it a yr earlier than expected in holiday 26' to get a yr jump on Sony,0
VaishakhD,3,Wrong word to be throwing around in the xbox subreddit,0
Raecino,3,"They showed the “tweaked” consoles.  They look exactly the same except one is all digital, one is a 2TB Series X and the other is a 1TB Series S.  I was hoping we’d get the cylindrical redesign but whatever, I’ll be grabbing the 2TB console this fall.",0
petataa,0,Well most of these games aren't out yet so idk how this changes that,0
xbox-ModTeam,0,"Thank you for your submission. Unfortunately, your post has been removed for the following reason: **Rule 1**  **Keep discussion civil**  Please remember:  * Discuss the topic, not other users.   * Personal attacks of any kind are disallowed.   * Be respectful - even in disagreement.   * Your point can be made without belittling others.   * Report violations - don't engage, which only escalates the issue.   * Retaliation is not justification to ignore this standard. (""They did it first!"")  [Please see our entire ruleset for further details.](https://www.reddit.com/r/xbox/wiki/rules/)",0
shadowglint,7,We have both SMTV and Metaphor coming this year..,1
Ruthlessrabbd,1,I saw that rumor of a 360 era JRPG returning but didn't really believe it  There's a lot of big JRPGs coming out in general this year across all consoles but I would've loved to have seen the next Tales game or something teased,0
Bonesquire,-15,At least you got some turn-based trash in the 33 game.,0
House_of_Vines,-4,Had to scroll way too far to find a comment about this. The strong female lead thing is getting so tiresome.,3
GuyHomie,7,"Your expectations are ridiculous lol. I would have liked those things too. You're expecting the best showcase of all time and ended up with one of the best ones in a long time and are now disappointed.  Stay away from insider rumors, and random message board warriors hoping for everything and just watch the show.",0
GeneralEmployee9836,2,All of those plus black ops 6 and Indiana jones for me! Also the star field expansion,0
Sharp-Pop335,2,get an external drive,1
TheMuff1nMon,12,No - it’s special cause it has 2TB SSD,0
AresOneX,3,Not sure but I was thinking the same. Will they still offer the 1TB disc version at all?,3
Lovelashed,2,They have been talking about it. But we knew it wouldn't feature here.,0
RocketEnthusiast,1,"We probably won't hear about TES VI before Starfield is complete (all DLCs). I don't expect the game to release this generation at all anymore, unfortunately.",0
PunishedHeartbreaker,3,Fable is coming in 2025 lmao why were you expecting Forza 6? It's coming in 2027 at least,1
probiz13,2,"Honestly, I wanted halo and everwild. Didn't get either but still thought showcase was great",0
eriktenbaag,3,Was expecting forza myself 3 years since horizon 5 dropped,0
twattner,5,How so? I thought it was one of the best Xbox showcases in years.,0
michaelje0,3,Thanks for letting us know.,0
j_l_123,-2,"Avowed, perfect dark and fable were reasons I bought the series x in 2020, FOUR YEAR AGO. How none of are out yet is still crazy to me, let alone none of them having a release date for this year. Xbox needs to get better at not showing games til they're nearly at most a year out",1
TheMindkilla,0,Facts! I game on handhelds right now like Steamdeck & the PS Portal. Such a wasted opportunity. I have a Series X as well but life makes it difficult to sit in front of a TV screen.,0
probiz13,17,There were a lot of them. What do you mean,1
anuncommontruth,6,...there were like 9 exclusives and three are coming out this year.,0
None,1,[removed],1
hammerandt0ngs,41,"Go download Sniper Elite 3, 4 and 5 and thank me later",4
Bad5amaritan,1,Go watch Modern History TV on Youtube. He's the CEO.,0
will_correct,0,Pique,1
Less-Witness-7101,0,"Pique*  Not being a dick, just tryna spread some good ol’ knowledge!",1
Fit-Obligation-8082,31,"In terms of the amount of games yes, in the delivery, no.  I’m in my mid 30s but I much preferred the showcase events of all the big 3 at E3, I want to be hyped / inspired to play a must- have game, with a human providing a introductory story and explanation of what I am about to see.  Like getting (~Hideo Kojima~ edit, cant strike through this) the game’s lead art director on stage to explain the tech behind Snake Eater remake would have been cool, as an example.  The quick fire trailer after trailer where I only learn the game that was shown after the trailer, and with only a few sentences spoke by humans at seemingly random interval's is not a format I personally am a fan of. And they could have really sold the new hardware they are releasing but it they spent 30 seconds on it. How is that going to make me want to buy one, the new Galaxy colour for the 2TB series X looks cool but where’s all the buttering up gone?  All that said, some great games were shown today.",7
CORN___BREAD,2,Well it’s easier when you buy up all the developers.,0
cslayer23,-1,They had 1 good show lol,0
ReservoirDog316,7,Yup. The best years of a console is right after they were on the ropes. And the worst years is when they get complacent.   There’s nothing healthier than both of them coming out swinging every year.,1
JACKDAGROOVE,1,"Big time, my PS5 is collecting dust and little else.",0
Bad5amaritan,1,"Get a Steam Deck. Owning any console that's not PC, is enabling the toxic anti-gamer BS that has trashed the industry.",1
JesusRice123,1,Most of these are coming to PS too so it’ll have to be up to the 2 exclusives confirmed to be Xbox only that was shown.,2
GrogJoker,10,Gamepass….,0
Zero_MaverickHunterX,5,"I don’t disagree, which is why I didn’t say they are great. But, the great thing is they’re all on Game Pass. So, you can try them out, and actually see for yourself. Then you can still buy it at a discount.",1
Pristine-Ad-2556,2,"That's incorrect. 300 gbs accounts for bo6, mwiii, mwii, all their modes, the base game, and warzone as well.",0
Link__117,3,"State of Play is never Sony’s big showcase, their big one’s always in fall. As for Nintendo, Midori said it would be “peak” so idk",1
Link__117,5,"For me it’s stalker 2. I’m a PS5 owner but that game looks fantastic, especially with the hell the devs went through to make it",1
Zero_MaverickHunterX,1,I’d say what’s currently on Game Pass combined with what they announced today on top of the ActiBlizz stuff that has yet to make its way justifies owning an Xbox and subbing to Game Pass. But to each their own.,0
Proof-Research-6466,12,Man it looked amazing!,0
StrikerObi,2,"I was super excited when last year's trailer featured Richard Ayoade, I presume motion-captured since the character looked exactly like him.   And then this year the character they highlighted was voiced by Matt King, who played Super Hans on Peep Show, one of the UK's best sitcoms ever.  Now my mind is just reeling trying to figure out how many other UK comedians they are going to back into this game for voice talent... can they get Matt Berry?",0
Proof-Research-6466,8,It looks awesome man! So I don’t blame you!,0
Richard_Sauce,6,"Really cool setting and aesthetic! The gameplay looked pretty generic 3rd person actioner, but as long as its solid I'll definitely check it out.",0
calvinien,3,"Same. (well aside from perfect dark, but I was already a fan so that shit is on easy mode.) That shit OOZES style. Everything about is is unique. And I love afro american folktales. Such an untapped source in a sea of samey looking action games. And I love how the magic is more about conjuring objects into being than just doing stuff. This is like the only game that justifies double jump by having hazel conjure a platform in mid air to jump off of. Brilliant.  &#x200B;  Now give me a low framerate mode so the whole game looks like the cutscenes.",0
StrikerObi,1,"South of Midnight looked incredible visually. I don't know what they did to make it look like stop-motion animation but also make it look super smooth. It's wild.   I just hope the gameplay holds up. What we saw looked like a God of War style action game. I'm optimistic that the game will live up to that in terms of visuals and narrative, but can they nail the gameplay and specifically the combat so it's as satisfying as God of War?",0
Proof-Research-6466,1,Only reason I got a series S! My fav Microsoft franchise!,1
Proof-Research-6466,1,I haven’t played a CoD since like black ops 2 I wasn’t even aware they were on number 6 😂,0
Bootychomper23,1,Man when they got that GF vs BF YouTuber to announce a game and he was just…..,0
