author,score,body,num_replies
princeoinkins,1,"why tho? Just buy an ally or steam deck, they both basiclly run windows, and anything you buy on xbox you can also play on windows in the xbox launcher natively, no streaming needed.",0
AJ_Dali,3,From what I recall it's the only mainline flight sim game still around. There was a 14 year gap between FSX and FS20. A four year gap for FS24 seems reasonable.,0
AresOneX,2,Makes sense as the special edition (2TB) will only be available in limited quantities according to Xbox Wire.,0
calvinien,22,">screen door effect  Hey! Sniper Elite 5 bravely answers  question that the other sniper games are afraid to even ask!  Questions like:  ""What if there was a sniper game with no sniping?"" and  ""What if the gore effects and destruction somehow got worse between sequels?""   or even 'What if we made a nazi killing game that penalized you for killing nazis?'",2
hammerandt0ngs,3,Fair. I also found the AI in 5 pretty lame,1
Bad5amaritan,2,Modern History TV on YouTube.,0
ReservoirDog316,2,Yeah really early e3 always had that boring chunk where they’d pause and talk about earnings and numbers but then there was a solid few years where everyone kicked it into high gear.   Then it all ended.,0
Fit-Obligation-8082,2,Tbf I am definitely showing my age with my remark there. I forgot he stopped working for Konami. ,0
ReservoirDog316,1,"Well that’s my point. Sony is *so* radically out in first place ahead of Xbox that they’re complacent. Xbox is on the ropes so they finally come out swinging.   Now to be clear, I think it’s a bit more complicated than just that since I think Covid delays from years ago did leave a gap in their release schedule, on top of TLoU live service game being canceled when it was presumably gonna be Sony’s big release of l fall 2024. But in a broader picture, Sony seems to have lost its way a bit by focusing away from their strengths and instead on live service stuff that isn’t panning out. I will say I *really* appreciate that they’d just allow ND to cancel that TLoU live service game instead of releasing it and sullying their spotless record (seriously, imagine Jak 3 being the “worst” game they ever released, insane stuff). People were critical of that but think how much respect they have for ND to just cancel a game that was presumably really far along in development. Live service games have launched with meager amounts of content at full price so they could’ve done it but didn’t.   But still, Sony needs to have a feel some competition to get back on the ball. I do believe if they revealed the stuff they currently have cooking from Sucker Punch and Insomniac and ND and all their other devs, it would be a little more even, but that stuff is probably late 2025 at best, so whatever. I personally like when they reveal stuff that’s a long ways off but I know I’m in the minority there.",1
Sheev_Palpedeine,1,"Pretty sure there is no next gen now, they talked about wanting to break the console cycle and they still haven't really brought out any significant series x only games",1
Link__117,0,"I just saw that, thanks for informing me. Just gotta hold out till December",0
Proof-Research-6466,1,Was going to try and play 1 this year 😂,0
Fun-Bag7627,6,I’d expect more of October to December. Sounds like 2025 will be a better use of your sub but you can always cancel it until these games come out. Might save you money long term.,1
Unknown_User261,0,"Unfortunately this isn't anything new. Xbox has an awful habit of dumping everything in the fall season. They could literally do their ""one AAA first party game a quarter"" if they figured out this. Last year was the most releases Xbox has done in the first half in a while (Hi-Fi, AOE console, Legends, Redfall) and only two were really good. Summer was dry as usual and then all their heavy hitters came out back to back in fall. Its actually starting to look like a problem if they stick to these release dates with how much Xbox first party games are going to compete with themselves all day one on Game Pass. Yeah, people won't have to buy one or the other but they still only have limited time. That's not even counting all the third party fall releases. I'd rather games like Avowed be pushed back to a really early 2025 just for breathing room because I do not see how it doesn't get overshadowed (and its one of my most anticipated releases).",0
Fun-Bag7627,1,Do we know about any big games coming up this fall? I’m blanking.,1
Dbear1108,6,"This needs it's own post lol. As the cover photo for GI gives me the impression that the trailer just had a stylized art, but the game will have the art style from DAI.",0
Recover20,2,I think you misread my comment. I meant the artsyle looks animated (like a CG or cartoonist animation) rather than gritty or real/ fantasy like. There has been a push lately in Fortnite or Hero shooter- esque visuals,0
ShopCartRicky,-1,"By that logic, every fantasy game is generic to you. The characters look like they fit in Thedas, and for them to look different would make them no longer look like they belong in Dragon Age.",1
ShopCartRicky,1,"Eh, I won't argue about DA:O, but Inquisition was really good if you avoided Hinterlands burnout and the DLC was fantastic.  We really haven't been given much to go by with this trailer other than character classes. All of the characters look what I would expect a character of that class to more or less look like within the world of Thedas.  I get a lot of people didn't like the tone of the trailer, but given the plotlines of the previous 3 games, I'm not opposed to what seems like a potential Ocean's 11 setup into a grander scheme. Pretty much every trope has been done at this point, so why not?",0
darkdeath174,2,"I'm hoping maybe they announce it on the Podcasts they are doing this week or it's a July event thing.     If it's just a shadow drop outside of doing an event, it will be weird to miss all those extra eyes.",0
Stymie999,1,"In addition to monitezing the skins some etc they want to grow gamepass subscribers… having all of the COD games on GP does that, just as it did with Bethesda.  They ain’t keeping black ops 4 off of GP because they are afraid less people will play black ops 6…. No way",0
Complique_,1,Lmao what are you talking about. The financial incentive is getting someone paying a monthly subscription.,1
FlyRobot,2,"Thanks for the info!  Yes, TR uses linear and open world aspects in the new trilogy which does affect how tight the gameplay and story feels when you randomly stumble across an area you aren't ready for.",0
AgnesBand,1,Retention is money though,0
juhpopey,3,This some magic math you done pulled out your ass.,0
Lovelashed,9,Because it will annoy that guy.,0
COSMlCfartDUST,3,**NAH IT’S GEARS 6.**,0
Gearsman133,3,No one cares about the new characters or the swarm. This was the right decision and much better than any potential gears 6,1
Flat-Ad4902,0,Are people still into gears for the story? People want more Kate? I don’t think so lol,1
Gearsman133,3,You must not be a gears of war fan then.,1
CptCroissant,1,They've gone indy but MS is announced to be publishing their next game... And it was already previously hinted and rumored to be Spyro,1
TabularBeastv2,1,"Obviously you have to take these things with a grain of salt but supposedly they are working on a game with Microsoft, and that it’s Spyro 4.   Source: https://www.eurogamer.net/spyro-4-reportedly-in-early-development-at-toys-for-bob",1
Chelmicus,1,Skylanders… I can always dream,0
deaf_michael_scott,-1,So BO6 could launch on GP but 10-year old COD games couldn't?  And games like Spyro and Tony Hawk also couldn't join GP?  LOL sure,1
North_Onyx,0,"If they're in a good spot now, I don't want them to take 6 years just to release another soft reboot",1
Uncircled_swag2,5,"Man, we really got a new Gears or Halo every year from 2006 through 2013 (even longer if you count MCC and the Gears 1 Ultimate Edition)  Weird to think there’s only been 1 of each in the last 5 years",0
michaelje0,5,That’s not who I responded to.,1
Good_ApoIIo,1,Ah so it wasn’t just me. 5 was cool in its own way but it basically felt like a less interesting Hitman because all I did was sneak around and shoot people with my silenced pistol and hide the bodies. It seemed like the only gameplay strategy that made sense in that one. Got old after awhile.,0
AveryLazyCovfefe,0,What the hell are your last 2 paragraphs.  Are you being serious? what the hell. I freakin loved 4 and was interested because 5 is on gamepass. That's revolting that they did that.,1
NotAnotherAmerican,-2,"I walked up to an enemy and he looked at me and did nothing. It happened a couple of times. I love my sniper elite, but 5 was uninstalled in 4 hours. I'm not hating, I mean I kind of am, but they didn't do a good job making it.",0
IssueRecent9134,2,"I’ll be honest, I don’t care who wins or loses, I just want to play games.",1
King_Sam-_-,1,I wanted to say that but I wasn’t sure if I was jumping the gun lol.,0
Ok-fine-man,1,I got three years on the loophole Xbox Live method last year. The past year has taken the actual piss. Just nothing but old games.,1
Uday23,1,https://news.xbox.com/en-us/2024/01/31/2024-xbox-games/,0
Vostroyan212th,5,I don't think you are as familiar with DA as you claim yo be. The trailer felt like the fantasy equivalent of a heist film trailer,1
LZR0,1,Didn’t you hear that alone ain’t enough to make up for selling games at full price?,0
RobertdBanks,1,So where does this story even lead then? It’s not a reboot. If the studio couldn’t make a worthwhile new trilogy then you somehow have faith that they’ll do well with a *prequel* of all things? They’re literally just going to do a game full of fan service as seen with this trailer using Mad World. Spare me the cheap fan service.,0
RobertdBanks,2,"The original trilogy I specifically played for the story first and everything else second. The Coalition not being able to get people interested in their new story just makes this seem all the more like a cheap way to play fan service. “Marcus and Dom are back fellas!”  I like Goodfellas, that doesn’t mean I want a Goodfellas prequel that brings characters back and shows me their unnecessary origin stories.",0
RobertdBanks,-1,"What lingering questions are there that the prequel will set out to answer?   I’m a fan of Gears, the Marcus and Dom story wrapped and that initial trilogy ended and ended well. The Coalition not being able to put together a worthwhile story and new trilogy (or however many games) doesn’t really inspire a lot of faith in me and this just seems like a cheap way to play fan service.   “You guys remember Marcus and Dom??? Well guess what??? They’re back!”   It just seems cheap imo. Their story wrapped, this just seems unnecessary.",1
LKN-115,1,"If that's the case, the lay-offs make no sense. And neither would them splitting off from Microsoft either. I guess we'll see in time",0
LKN-115,1,"The article is from March tbf, it very well could've changed since. I hope I'm wrong in any case, I think they could do a pretty good job with it",0
None,1,[removed],1
Sharp-Pop335,0,"Aren't they doing another halo ce remaster? For all the lore halo has they really don't want to cut ties with chief. Give us a game based around contact harvest or ghosts of onyx. Or a game where you're an oni agent doing halseys dirty work or something.  Another odst, anything.",0
Jerry_from_Japan,-4,Uhhh you responded to someone who agrees with that post lol.,0
calvinien,5,"It's exaggeration. The game tries to be more like metal gear. So the optimum solution in most situations is to sneak up on a guy and choke him out.  You get more exp if you don't kill people. In the game series made famous for showing an xray  view of your bullet destroying nazi testicles. It's weird.  The game is also MUCH less forgiving in terms of detection so if you don't have a perfect stealth build, sniping is going to attract attention and get literally dozens of soldiers on you. The level design makes it very hard to avoid gunfights. I can't remember EVER using my SMG in the first game. I used it constantly in 5, and that was while save scumming constantly to avoid alarms.  It's not a bad game, but all of the new mechanics and level design detract from the major reason anyone plays the series, which is shooting nazis in the dick and watching the bullet obliterate each organ on the way in and out.  It's more Commando Elite than Sniper elite.  &#x200B;  Let me put it this way...I discovered the nut shot cam by accident in previous games...and I couldn't get it to trigger in this one. I don't even know if it exists in 5.     It' like playing gears without the curb stomp.",2
ReservoirDog316,1,Yeah that’s the point. The best thing that can happen is both sides competing and firing on all cylinders. They’re trying to win but we’re the real winners.,0
None,2,"It’s why I canceled, it’s cheaper to just buy the games I want than pay a sub for games I don’t.",0
ShopCartRicky,1,Why wouldn't that feel like Dragon Age when Varric is the focal point of the trailer? Are you sure you know Dragon Age?,2
Gearsman133,3,"But this is during e day, about 13 years before gears of war 1. There's plenty of story to be told about young Marcus and Dom. Plus nobody cares about the swarm or kait, this is just infinitely more interesting than that.",0
deaf_michael_scott,-1,Very logical rebuttal.  I’m convinced.,1
Enabler0,1,The name of the game is so generic.  Does it have any sort of story or is it literally a sniping simulator,1
Sux499,0,Sounds like a you issue.,1
Vostroyan212th,5,"Look, I'll he happy to be wrong, but after inquisition and andromeda I have little faith in bioware, and this looks and presents itself as both a hero shooter and a heist film. I want a fantasy epic, and not a Guy Ritchie fantasy from a studio whose best years are 15 years behind them.",1
ScottSterling77,0,When did you start playing Dragon Age games?,1
Imthecoolestdudeever,2,No one would convince you. You've made your stance very clear.,1
calvinien,2,"Oh it has a story. I just can't remember it despite playing the game last month.  The story of all of the sniper elite games is usually some variant of ""NAZI GUY IS DOING A BAD! FIND OUT AND STOP HIM.""  There's usually a plot point about sabotaging some nazi superweapon like the V2's or the Ratte. The story is not why you are playing.  You are playing because gun go pew pew nazi go boom. Wolfenstein this aint.",0
WillBeBetter2023,3,And me.  Everyone loves shooting Nazi testicles,0
ShopCartRicky,1,"Personally, outside of spending too much time in the Hinterlands, Inquisition was great imo, especially the DLC. Andromeda was fine. Done a disservice by being in the Mass Effect universe because it obviously doesn't come close to the trilogy.",0
ShopCartRicky,0,"2009, well, 2008. Friend's father worked for Bioware, and I got to play an early alpha at their place.",0
deaf_michael_scott,1,"You know you could just share your source for the (incorrect) information that proves there are clauses preventing older COD games and Spyro and Crash and Tony Hawk etc.  from joining Game Pass, instead of doing personal attacks, right?  If that were the case, I'd have stood corrected.",0
