author,score,body,num_replies
FelonTusk,8,"I miss some talking in between too, but I absolutely hate it when it's the execs doing the talking. Bring on the devs and let them promote their games. Or some mediator whose job is to jest. These execs are just the worst of both worlds.",1
Flat-Ad4902,1,You are speaking directly to me lol,0
Fun-Bag7627,44,This was my only criticism about the direct. I understand not setting in stone something in 2025. That shouldn’t be a case for a game expected for 2024. I have doubts a game is coming out this year if they can’t confirm a date in the next 6 months.,2
Unknown_User261,1,"My hope is that this is the year Xbox does a ""direct"" every quarter to announce release dates 3 months out. I just know that's probably not going to be the case. The problem with no release dates is Xbox only has 2 major first party shows a year (and that's somehow a vast improvement from last gen). A developer direct in January and a showcase in June. Xbox should do a better job at consistent times people can expect to hear updates about all their ""coming soon"" titles.",0
homerd0h,1,"Not just that, but enough with the trailers and clips for games with no real release dates. ""2025"" tells me nothing and just annoys me. Especially when some of these titles have been teased for years already. I don't need to know about games coming out more than a year from now, especially when they will just be delayed over and over again. ",0
Recover20,10,"Gameplay would've been good but at least were getting that on the 11th. However, the style of the game is not what I was expecting. It looks too.... Animated? Inquisition had a super solid art style",2
calvinien,1,"From what I've heard from journalists, the trailer radically misrepresents the tone of the game.",0
deadline247,11,The characters looked like they were created by a corporate committee.,0
Hercusleaze,2,"This. Bioware is a husk of what it once was. But as if Andromeda and Anthem never happened, people are still excited for more for some reason.  I'll believe they can still make a great game when I see it, but I don't get excited from their teasers anymore.",0
ShopCartRicky,-7,"I'm not sure you know what generic means. You're right about Bioware, though. Still excited for it despite that.",1
ShopCartRicky,3,"South of Midnight is one of my on the fence games. The stop motion animation is gonna be tough for me to get into, and I need to see more of the traversal.",0
ShopCartRicky,1,That's fair. I personally didn't love the originals and think this looks good. I just hope it ends up being more like Hitman or Deus Ex in how open the gameplay is rather than similar to Splinter Cell like in the trailer.,0
ShopCartRicky,2,Nothing. I like Dragon Age. Sorry for your misery.,1
darkdeath174,31,"BLOPS you could could build hype for by releasing 1/2 in June, 3 in July, 4 in August, 5 in September, then you have 6 in October.     Plus ABK also has a lot of non live service games that can hit game pass and possible backcompat. not limited to just COD.",1
Stymie999,1,All of the things you listed that you think they want to further monetize are elements that would not be included in gamepass… so your argument makes little to no sense.  In fact if they wanted to get more money from those things they would be better off putting the game on gamepass to expand the player base,1
juhpopey,1,Ya all I could think about was uncharted when watching the new trailer.,0
FlyRobot,1,How do the newer Tomb Raider trilogy and Uncharted series compare with one another?  Never played the latter and they seemed very similar in gameplay and style (both of which have Indy vibes),1
evlampi,3,"""Cho-cho, cho-cho ahahah"" almost peed myself laughing, machine games does amazing nazi villains.",0
Moorepork,-8,"It might be good the first time, but it kills replay value. If I want to watch an Indy movie I'll just do that, if I play a game I will generally want some instant action.  Games like Wolfenstein, Guardians of the Galaxy, Tomb Raider are the same - too much time with cutscenes and build up sequences, not enough actual gameplay.",1
arex333,1,"I thought I had read that development was pretty rough, but maybe I'm mixing it up with another game.",0
Coraldiamond192,9,I imagine it’s simply because they want to push gamers towards the current/ new title as opposed to the older ones. It makes sense to do that even if people might want games like Black Ops 2 etc.,0
makeanamejoke,20,I'm paying for game pass tho,2
iGoTooWumbo,3,"I’m against the shotgun blast of Activision games onto GP that some people recommend, but you are out of your mind if you think putting old CoD’s onto GP won’t drive subscriptions",0
CptCroissant,8,You do realize that ABK isn't only CoD right???,1
None,23,[removed],0
Hunter50502019,10,"What do you mean, since 1932?",1
Flat-Ad4902,1,And no mention of a release date which means we are looking at 2026 at best.,0
faithOver,6,Yes! So epic. So epic.,0
beastinthebank,1,"Im not sure why people couldnt hear the track was mad world the entire trailer until dom saved marcus, If you didnt know that, rewatch the trailer and listen closely",0
ElPadrote,4,"But like, if we were counting gears games chronologically? It would be the 7th iteration?  Unless we’re gonna be pedantic and start counting mobile, tactics and pop games?",0
Lovelashed,6,Nah it's Gears 6.,2
slickshot,1,I'd bet holiday 2025.,0
Flat-Ad4902,7,It has the main cast that everyone loved and explores E-day which should feel a lot more like Gears 1. I expect this to be an attempt to go back to the vibe of Gears 1 and 2 which is exactly what the community has been asking for for years.,1
SOLR_,5,This prequel is something fans have been wanting for years.  Also there are some really nice details about the project that should differentiate it from the rest of the series  https://preview.redd.it/jbr1xy6cum5d1.jpeg?width=1179&format=pjpg&auto=webp&s=cc5b107ceac7df75c2ff308a77ddcf62dcf6b8ed,1
MrMusou,3,Haven’t played Gears since early 5 and I think there’s a lot of cool stuff they can do with E-Day. Having Dom back is a boon as well. Won’t deny I’m a bit skeptical regarding “The Coalition” but I’m staying optimistic for now.,0
x7iamx,12,I wanted Blinx the time sweeper to return lol,2
RocketEnthusiast,3,Isn't it rumored this is what Toys for Bob are working on? I guess it's still too early.,3
TheDarkRedKnight,2,100%. It was about a minute into the Assassin's Creed trailer and I still wasn't sure if it was AC or another game that's nearly the same.  I really wonder why they're sitting on all these family-friendly IP.,1
calvinien,2,It's been that way forever. In the early 90s it was mascot platformers. Mid 90s saw a shift to car combat and survival horror. 2000s was open world and sci fi shooters. 2007 to mid 2010s was mil shooters. Then it became hero shooters and battle royales. Then looter shooters and ubilikes. And now it's soulslike and roguelikes.,0
Golden-Event-Horizon,6,"Yeah, but we actually know that it was going to come after Starfield. We don't even know if Everwild still even exists",0
PlayBey0nd87,11,Well the direct is going now. Maybe they’re saving it to have Treyarch & Activision reveal it there at the end,0
deaf_michael_scott,1,"No that’s not true.  The back catalog can join Game Pass whenever Xbox/Phil decides.   There’s no obligation preventing that.  The obligation was only for the last COD for which Sony had the marketing deal.  That’s no longer the case with Black Ops 6 and onwards, which is why BO6 is launching on Game Pass.",1
None,0,[deleted],3
North_Onyx,-1,"Yea, that's the worrying part lol",1
DblClickyourupvote,5,Sure you can,1
princeoinkins,1,"Am I the only one who wants DLC for infinite? The story mode was great, Just the story itself was a little weak.  Plus it's an open world game sotry DLC would be super easy.",0
srjod,2,I mean I won’t like I’ve been unhappy with them for awhile but this was the first legit rah of light I’ve seen since Phil took over. The acquisitions appear to match output which will fuel GP. I haven’t subbed to GP in over 2 years but absolutely will to play all those titles. That’s an absolute steal and insane value.,0
anuncommontruth,7,My guess is marketing isn't ready. I predict that's going to be a big title with some tie-in stuff.,0
MasterLogic,-2,"They're getting delayed, it would be extremely stupid to shoot your load and releases 5 bigish/exclusive games in a short period and then have almost nothing for the next few years. ",0
LZR0,13,"It’s obvious a handheld wouldn’t be teased as it’s part of next-gen and it’s just too early, clickbait “journalists” who literally come up with even the most ridiculous rumors came up with that and some people chose to believe and to expect it smh.",0
MyMouthisCancerous,6,I'm really surprised they didn't give a hard date on Avowed. I expected that to definitely fill out the October timeframe especially with how visually improved it looked from the previous showing earlier this year,0
Coraldiamond192,3,I would rather not have a date until the game is actually ready to be released. I’ve been burnt out before by games announcing either a release date or post launch content that then gets delayed because it’s not ready.,0
michaelje0,23,lol there’s no pleasing you guys.,5
PepsiSheep,5,"What about Spyro, Crash, Prototype, Diablo 2, Tony Hawk, etc?  CoD is the one I care least about.",1
randoul,8,The moment you checkout they will shadow drop the new controller. It's the law,0
ADIDASinning,8,Why have new hardware when this has been the most dry console era yet?,0
IZflame,1,Something like an rog ally or legion go that can natively run like games,2
j_l_123,0,So would you be okay if all of them were delayed to 2025?,0
Blitzindamorning,4,"Ikr! Seriously, it's not a good look to have a long drawn-out trialer for WoW and not announce a console version.",0
Blitzindamorning,1,"Oh, I bet its good for people who like those type of games similar to Forza Im kind of fatigued with them.",1
princeoinkins,1,not all the games but alot of them are,0
REPTILEOFBLOOD,3,"I'm just saying a new announcement from Square Enix, or a Final Fantasy XVI port to Xbox would've been nice",0
Plutuserix,3,"Doom, Indiana Jones, Gears, own character select in State of Decay, Diablo, Elder Scrolls Online, Avowed and I bet a choice in Fable. So... Perfect Dark, and established character from all the way back to the 90s, and South of Midnight are left for the first party games.  You had to scroll so far because 1) your complaint is idiotic and 2) it isn't even true.",0
RobertdBanks,-5,"1000%  I’m all for mixing it up, but getting tired of seeing little skinny girls taking on giant hulking demons and everything else. It’s just so transparent and an eye roll when every studio is doing it at the exact same time.",0
Raecino,-5,"I’m glad you two are saying exactly what I was thinking 😂😂😂  I just finished AC Odyssey where the “canon” MC is female, yet after beating the game with the male MC it felt more natural.  Sometimes it feels like they force a characters gender change to avoid controversy or something.",0
Squishymate1121,1,Got one but i still have to transfer everything back and forth which is quite tedious,0
CytronicsZA,2,Unlikely,0
PikachuAndLechonk,2,It does say that they will join the current lineup. But who knows. The digital only army are hell bent on digital only with less consumer options.,0
Caesar_35,1,"Probably. This one has the little green specks on it, and is 2TB.  Normal, plain black, 1TB disc version will probably stay the standard.",1
BudWisenheimer,0,"> Fable is coming in 2025 lmao why were you expecting Forza 6?  I’m sure some of their resources overlap, but Playground’s Fable team is separate and mostly in a different location from their Forza Horizon team.  Several of Microsoft’s studios have more than one dev team.  It’s entirely possible that FH6 could release in 2025 just like Fable.  But if there is a next-gen Xbox in 2026, it would also make sense to save it for a launch title.",0
pratherj23,4,"I do prefer Nintendo’s approach more by waiting until a few months or a short while before a game releases to drop news. But as big as Microsoft is they have to promote this stuff early and often. And they want to keep growing the XGP subscriber base. Which even without all these awesome games is still a great service.  I also think people need to temper expectations. Games are just massive these days and so much more to code. It’s wild to think that GTA 3 and Vice City were released a year apart, then San Andreas 2 years after. But that just isn’t going to happen anymore with the scale of modern games.",0
Zeo560,17,"There were Indy, State of Decay 3, Perfect Dark, Starfield's new DLC, GoW E-day, Age of Mythology, South of Midnight, Avowed, Mixtape, and Fable. So 9 exclusives besides Doom and Blops 6 which are confirmed to be coming to playstation. That is a good amount of exclusives in my opinion.  Edit: I forgot Flight Simulator 2024. So there is 10 exclusives.",0
xbox-ModTeam,1,"Thank you for your submission. Unfortunately, your post has been removed for the following reason: **Rule 1**  **Keep discussion civil**  Please remember:  * Discuss the topic, not other users.   * Personal attacks of any kind are disallowed.   * Be respectful - even in disagreement.   * Your point can be made without belittling others.   * Report violations - don't engage, which only escalates the issue.   * Retaliation is not justification to ignore this standard. (""They did it first!"")  [Please see our entire ruleset for further details.](https://www.reddit.com/r/xbox/wiki/rules/)",0
NotAnotherAmerican,11,"3 and 4. If you've played 4, you've played 5, except 5s graphics are worse and the screen door effect is terrible.",2
dljones010,1,"Oh, that's who that is?  Damn. Those are good games.",1
Natural_Parsnip_5291,1,Go play The Warriors and thank me even more ,0
ShareNorth3675,1,Ah it's sad to know it's from the devs of sniper elite. ,0
DapDaGenius,1,Huh?,0
DapDaGenius,1,"Thanks fam. I had a couple people correct it but they were rude about it, so i left it until you came along. Lol",0
Jonesy_lmao,38,We lived through a golden age bro.,1
T0Rtur3,35,"People have been complaining, ""Where are the games?"". MS said, ""Here you go.""  I'm guessing they just had to show only trailers to keep the whole thing watchable in their target timezones. I'm in the EU and it ended after 8pm, which on a Sunday is about as late as they would probably want that to run.",0
Unknown_User261,8,"I mean we still have a week of deep dives. Last year it was the extended showcase (I assumed we'd get that again, but they haven't specified so I'm not sure the medium, hopefully not just xbox wire articles). But they go into tech and stuff there.   The big miss from E3 is the convention atmosphere and on-site presence. A live digital showcase case just isn't really ""live"". Even just playing the prepared showcase at a major onsite venue is just different. Nothing I've seen of Xbox Fanfest or Summer Game Fest really replicates this. I never got to go to E3 myself, but I have started going to major conventions like MCM London and even stuff like the Sonic Symphony and the vibe just hits so different. In comparison the ""not-E3s"" all feel just too ""controlled"".   I think Microsoft is probably in the best position now with all the first party content they own to put on a major comic con level convention in the summer around the showcase to bring gamers together. And I really think they should. It'd do so much for the Xbox brand (which gets so much hate or is just ignored or unknown because Microsoft doesn't market it) and make it a center of gaming. These past few showcases have shown a major dedication in working with partners for huge third party reveals. They should bank on that. They don't want to make every third party game exclusive like Sony. That's fine but they still need to do something to tell people to buy an Xbox to play those games. Creating an E3 where Xbox branding is everywhere would be one way.",0
FMC_Speed,2,"Agreed, all big companies would have their own showcase days apart so we’re guaranteed a week of reveals and demonstrations",0
GhostINVINCIBLE,3,You hurt me with the Kojima remark..,1
Multifaceted-Simp,1,I want the crowd to reach too,0
calvinien,1,"I do miss the pageantry.  But as Geoff Keighly has shown us, the pagentry is nothing without actual stuff to show.",0
IssueRecent9134,1,"I wouldn’t say Sony came out swinging this year, their showcase was pretty weak 4/10 at best. Just remastered and re releases on Pc is all the showed. The only new thing was monster hunter and that’s multi platform.  Xbox showcased actual new IPs and several new Bethesda games come out. I know these are on PlayStation too but these are Xbox’s IPs. The games Xbox showed appeal to me more.",1
Neat_Clothes_248,1,"Consoles are on there way out anyways. Pcs are getting very popular, streamers use them so the young kids all want pc now.  Plus with game pass and ps plus streaming, I'll honestly be surprised if we see a ps7",0
IndependentRoom5919,6,"Here's what's confirmed as an exclusive to xbox  South of midnight, Gears of war: E Day, State of decay 3, Fable, Avowed, Frag punk, Perfect dark, Age of mythology, Winter burrow, Flight Sim  Timed xbox exclusives  Indiana Jones, Stalker 2  Oh and just for good measure here's the exclusive expansions coming to xbox  Starfield: shattered space, Alan wake 2: night springs",0
King_Sam-_-,0,I feel like Elder Scrolls 6 is about the only thing that can make a difference for Xbox. That for sure is going to be an exclusive but I think it’d be wise for them to release them right at the beginning of the next gen and make sure it knocks it out of the park.,1
Jonesy_lmao,1,"That is a big distinction tbf. It’s always worth a download if it’s on GamePass.   Fingers crossed they live up to the hype.   And tbf, Perfect Dark Zero and Assassins Creed did live up to the hype back in the day.",0
HMS_Sunlight,0,"Huh, didn't know that about Sony. And yeah, I just saw the Midori post, so I'd love to be proven wrong there. Still think this presentation was incredible though. Avowed and Life is Strange are easy day one purchases for me, and those weren't even the games most people consider the heavy hitters.",0
SinZerius,0,Thought that was just a timed exclusive.,1
DocBrutus,2,I’m currently playing 2 and 3 lol,1
Steel_Ketchup89,4,"So, so true. The super slow corporate speak with the epic, cheesy music behind it is really hard to take seriously. I'd almost feel bad for them if they weren't being paid so much...",0
Ok-fine-man,6,"Yeah, I have suspicions they're cynically going to wait until Xmas to release these. Feels like a year wasted on my sub. Like, I was expecting to eat well in 2024.",2
Uday23,1,They may be waiting for other games to announce their dates first to plan around them,1
The_Green_Filter,7,[You may be interested in this screenshot from Game Informer!](https://www.gameinformer.com/cover-reveal/2024/06/09/cover-reveal-dragon-age-the-veilguard),1
SolomonGrundler,0,How dare a games cinematics have properly emotive humans instead of animations from 2014,1
Vostroyan212th,2,"What I mean is that they look like every single cover art character we see now. Everything is flashy, everything is clean, and there is little soul to them. They will look good in advertisements basically",1
ScottSterling77,1,Less misery and more expectation followed by dissapointment. DA:O is the pinnacle of the franchise and this is a far cry from that.,1
LZR0,5,"Exactly, it’s baffling they are not doing it already, it would show people that Xbox and Game Pass is now home for Call of Duty and all other franchises…",1
LZR0,1,"That’s the point, none of that is included in Game Pass, what they want is that in top of paying for Game Pass you pay for some MTX, battle pass or whatever else to “make up” for the “loss” of not outright selling the game at $70.   They will be able to to that with Black Ops 6 as they’re already doing with Diablo IV, but putting Black Ops 1, 2, 3 or any older title there’s little to none they could further monetize on those games, plus the real problem is that older games can eat into the audience of the current games which are way more profitable, now you get the issue?  But as I said, that only applies to live-service games like CoD or Diablo as it’s a valid reason from a business standpoint, but I see no explanation at all as to why games like Crash, Tony Hawk, or Spyro aren’t on Game Pass yet.",2
shockwave8428,2,"I would say uncharted is by far better than tomb raider personally (uncharted is my fave game series ever), but tomb raider is still great. Uncharted has much better stories, much tighter gameplay, and much better set pieces to where you feel you’re in an action movie. The first uncharted is a bit worse than the rest of them but still solid. A big difference is that tomb raider is semi-open world, with random objects and collectibles dotted around, I think there was crafting too. Uncharted is linear, no crafting at all, and is overall a very polished and concise experience (you can beat them all in like 10-12 hours each first time through).  What I love about uncharted is they really know what they’re trying to do and stick to it. Even on ps3 the graphics were great for what they were, stories are awesome, puzzles are fun, and Nathan drake throws around great one liners. I would definitely recommend everyone play through the uncharted series at least once.  So I did enjoy both series, but overall I just like the well curated gameplay of uncharted. Ultimately you’re still doing the same stuff though, traveling to exotic locations, looking for treasure, solving puzzles, shooting bad guys, and climbing around ruins. They’re great fun.",1
Tobimacoss,1,"How many times do you intend to replay the game that you can't watch an hour or two of cutscenes in small intervals at a time?     Like even if you love the game, it's single player title, you can replay it once a year, the cutscenes are not going to ruin the experience.  ",0
Solidsnake00901,0,You were already paying for game pass before the acquisition im sure. That's not new money.,1
MasterLogic,-5,"You pay $10 a month to access $100,000 worth of a game catalogue, you playing a game for 40 hours still gets the developers a split of like 5 cents. ",1
Imthecoolestdudeever,1,There may be more IPs involved in the time restrictions than just COD.,0
hybridvoices,3,"Fun WW2 fact: In order to standardize vehicles for seamless integration into American, British, and Canadian forces, drivers and machine gunners in Sherman tank crews used Xbox controllers. Unfortunately Microsoft wasn’t able to finish the software drivers for the main gun by 1945. ",0
Stoic_Vagabond,5,How?,1
badass_dean,4,Say it louder!,1
RobertdBanks,-5,"Cool, go back to that vibe without making a prequel that doesn’t really serve anything as far as the narrative. They 100% could have captured that vibe while also moving the narrative forward.",2
RobertdBanks,-2,"Yeah, ngl none of that seems essential or all that interesting to the overall story.",1
NtheLegend,4,"If they could do Blinx right, it would be absolutely amazing.",0
IndiaPaleDale,1,All this time I have never heard of anyone but myself wanting that game back.,0
metallica123446,1,"I hope so, and I think that’s the latest rumor",0
dyrwlvs,1,"Personally I want them to try their hand at Banjo, but with them independent not sure if that's happening.",0
LKN-115,0,"Toys for Bob? You know they've gone independent again recently right? Not a part of Activision any more, and had a good few lay-offs too. So definitely not working on Spyro",3
navelfanatic,1,especially when Sony is releasing Astro bot which had a good amount of hype. A lot of these AAA games look very samey to me.,0
None,-1,[removed],1
Nickelnuts,5,Infinite is such a good time now. So much fun,0
spund_,8,I was playing it last night and it was tremendously fine. ,0
TabularBeastv2,3,Infinite has been great and running strong.,0
DapDaGenius,7,"Nah. Let them cook. New management structure should put ease on the leadership issues that 343 had. Couple that with Xbox pumping out titles, 343 can really take their time to release a full product without the hiccups that infinite had. I feel 5 and infinite fell to the fact that Xbox’s first party was really struggling to consistently put out titles. So Halo suffer from the poor management and being rushed.",1
FatherGabriels,2,They have to stagger them,1
superduperpuppy,6,I do understand the frustration on the lack of release dates for their 2024 games. Xbox hasn't had the best track record when it comes to sticking to schedule.,0
kennerc,0,"Dude, we are past the mid of the years, the games releasing this year should have at least an expected month of release.  This would also be a great time to put the acti catalog in gamepass.  All eyes were on Microsoft, it did it great, but with a little more effort they could've done more.",0
Whofreak555,-2,Release dates and gameplay. That’s it. That’s all they gotta do.,0
PepsiSheep,-6,"*gives show an 8/10*  ""There's no pleasing you guys""",1
Infamous_Fox3910,-4,Wanting actual release dates this far into the generation is too much apparently.,0
Imthecoolestdudeever,1,There may have been more than just COD involved in those timelines.,0
boop1234567,1,Oh shit thats dope! I’ll definitely snag one of those,0
