author,score,body,num_replies
hammerandt0ngs,283,Atomfall! Anything from Rebellion is always class,3
Zero_MaverickHunterX,439,"This was legit an all time great showcase.   DOOM looks amazing Expedition 33 looks amazing Perfect Dark  looks amazing Flintlock looks great Avowed is looking fantastic now Indiana Jones looks really strong STALKER 2 looks next level South of Midnight looks really great Atomfall looks really great AND They showed a new GEARS finally. All of which are coming to Game Pass DAY ONE and then some.   Oh, and Black Ops 6 actually looks really great as well. MS knocked it totally out of the park with this one",10
Proof-Research-6466,144,Cannot wait to play Fable and South of Midnight.,6
Virtual-Face,109,"One of the better shows in my opinion. Lots a big titles, no useless talking in-between. Loved it.",2
ShopCartRicky,189,"Fable, Avowed, Perfect Dark, Dragon Age and Expedition 33 all looked great imo.",6
supermightymatt,265,Some great games shown but why are they sitting on the Activision games catalogue and not putting them on gamepass,10
br1k,55,"I'm getting massively hyped for Indiana Jones. It shapes up as a full fat Indy adventure, also looks much better than on the last presentation.",3
TheCookieButter,22,No Banjo Kazooie :(,3
daNEDENhunter,18,Wish we'd actually got some gameplay footage of State of Decay 3. Makes me worry about when we'll actually get a release date.,3
Loch_Doun,124,"They are sitting on a huge back catalog of Activision games to drop on Game Pass, I’d really like to know what the hell they’re waiting for.",5
therealist11,49,Amazing showcase. This is how it’s done.,0
AresOneX,70,Really good showcase! The best one we had in years imo. Maybe even in a decade. The only letdown for me was no handheld announcement. But the games were on fire!!,1
Laughing__Man_,24,"I liked it, waiting for Flintlock, Fable and Avowed.   Wanna see more of Perfect Dark before I get to excited.  And of course Indy was a highlight.",1
Galactus1701,28,I’m happy with Gears 6 and DOOM Dark Ages.,2
MrMusou,22,Gears will likely get me on Game Pass again but who knows when we’ll get more info on that. Rest of the show was solid but no real surprises.,2
Mapsters,18,Downloading GoW ultimate edition about to play for the first time 💚,3
TheDarkRedKnight,50,"I was hoping for a mascot platformer, whether that’s Crash, Banjo, Spyro or any of the other characters they own but are sitting on.   Too many highly-detailed sci-fi/East Asia/fantasy action RPGs.",5
outla5t,8,"Honestly best game showcase I've seen in years and best Xbox showcase in a decade or so. Lots of great games shown including Perfect Dark, Gears, Fable, DOOM, Indiana Jones, and Diablo IV expansion with some excellent looking third party games including Dragon Age, Wuchang, Stalker 2, and South of Midnight. Just banger after banger after banger, that's the way you put on a show well done Xbox.",0
Couinty,15,it was so good,0
Golden-Event-Horizon,23,It's now been *checks watch* 4 years since Everwild has been last shown,3
Turbostrider27,9,"Easily 9/10 or possibly a 10/10   The only thing I was bummed about is no release dates for big titles like Avowed and Indiana Jones. Otherwise, best showcase, on par if not better than Microsoft's E3 2018.",0
JulianVault101,27,No CoD Games on Game pass?,2
CompetitiveDeal498,11,South of Midnight looked really fun but I always love the Louisiana bayou hoodoo setting,0
CrustyCally,6,“The real Elder Scrolls were the friends we made along the way” ahh trailer,0
ElementEnigma,35,F in the chat for Halo I guess,5
srjod,14,This was the absolute flag planting of the brand finally arriving and becoming a beast. This felt like 10 years of waiting for them to have a showcase like this. Absolutely fantastic and bravo to them.,2
DaBestCommenter,6,Microsoft Flight Simulator 2024 ftw ✈️,0
DemoEvolved,5,That doom trailer was quadruple A.,0
CoSMiiCBLaST,6,"Honestly almost every game from this showcase made me excited. Indiana Jones, Gears Of War E-Day, Avowed, Age Of Mythology, BO6, Perfect Dark, Doom The Dark Ages like holy shit they really went all out",0
PapaYoppa,6,"This showcase was so much better then i could have anticipated, im an xbox player and these past months Ive been slowly losing hope for xbox, this showcase brought me back, so many great games shown, cannot wait 🔥🔥🔥",0
king_noro,4,"I feel weird saying this because it still *feels* like we're early on in this console generation, but if even 80% of what we saw deliver on their potential, I'm going to feel like I got my money's worth with the Series X.  We have so much to look forward to over the next 2-3 years.",1
SaltySwan,5,That showcase was amazing. I know you guys gotta be happy.,0
Best_Pollution1632,5,Why is no one talking about Metal Gear Solid 🥺🥺🥺,2
Outrageous-Yam-4653,5,DreamcastGuy a 4/10?where you at now clown?,0
Fit-Asparagus8557,6,"From start to finish, this showcase delivered. CoD of course looked amazing!",0
SHADOWSTRIKE1,17,Another year where Microsoft just sits on the Banjo-Kazooie IP…,2
Accomplished-Ad5280,8,A new DOOM! Looks awesome! Hope it will be sound great as Eternal was,0
PepsiSheep,51,"Great show, however:  Where is the ABK library on Game Pass? Where are the dates for 2024 games? Indy and Avowed look great but you can't even lock in a month?  Why don't we have an ID@Xbox section or much from the partners?  8/10 show, and some amazing games. But as a consumer it's a touch, just a touch, frustrating.",6
sludgezone,3,I wanted a new Heretic/Hexen but fuck it I’ll take dark fantasy Doom. Perfect Dark looks sick too.,0
seantenk,4,We are so back,0
MrFOrzum,2,"Might have been one of the best Xbox showcases in many, many years, if not even the best one they’ve ever done. Tons of good stuff here. Imagine how empty it would have been without the Bethesda & activision purchase lol.   Stalker looks insane.",0
Josh261995,4,One of the best showcases,0
Johncurtisreeve,4,"AMAZING SHOWCASE.  Was shocked about Gears EDAY which is really cool, but what about gears 6?  Surely that must be happening?  It was really cool to finally see PERFECT DARK and Fable both look amazing.  Just about everything in the showcase was BOMB.  DOOM absolutely stole the show for me and Im actually excited for the new COD which I haven't been in years.",1
Mental-Macaroon8153,3,"Dragon Age, Indiana Jones and Atomfall are definite buys.",0
ATrollByNoOtherName,4,What a showcase!  That Doom reveal and gameplay incredible. Holy shit!  Gears going back to early days is a nice surprise.  So many bangers here.,0
Luxowell,4,Mixtape was obviously created by a team my exact age and I'm fucking here for it!,0
Kami_Blake_Aur,3,"I liked it. Was worried how much the black ops direct would cut in with only 2 hours reported, so I was so excited as soon as Phil confirmed it'd only be like 30 minutes. The showcase ended up feeling longer than usual.   My only two complaints were no Halo (it could have joined the live service brigade with a <2min long trailer just to show Xbox still remembers the IP; ESO got a long-behind trailer for an expansion that's already launched on PC), and a complete lack of real platform or ecosystem announcements. The hardware reveal at the end was awful. I wasn't expecting a handheld (I saw BS on that rumor a mile away; plus it'd mean its a generation behind in 2 years according to other rumors), but anything from an update on Xcloud to just that they're working with ABK to make new games backwards compatible would have been nice. I think an Xbox Showcase (the only time everyone's eyes are on Xbox and gamers all around are talking positively) should really have a ""this is why you should game ON Xbox"" moment.  At any rate, Xbox's showcase is closer to replacing E3 then Summer Game Fest with all the hype reveals. If I were them I'd bank on this for future years. Get the Xbox brand out there and make it associated with gaming globally.",0
DarkestDisco,3,"#Get out of here, stalker",0
Raecino,3,"Well I’ll finally get a Series X, the 2TB one.  Kind of disappointed there wasn’t a redesign of the console though.  I thought the cylindrical design they showed in the mockups was looking good.",1
AKINA_SPEEDSTAR,3,No Forza news 😔,0
mogulripper11,3,A damn good showcase,0
Mr_Coa,3,"Great event I'm very excited for, Flight sim, black ops 6, life is strange, mixtape, Gears of war, Indiana Jones and Fable",0
animationmumma,3,this showcase was amazing Xbox is on fire I'm so excited for all these games and gears of war and Indiana Jones looks amazing am avowed I am excited to play,0
dstranathan,3,Stalker 2 is all that needs to be said.,0
BitterPackersFan,3,"Does anybody have any dates and times of stuff being shown off in the next week for Xbox?  I know of the Ubisoft Showcase, but I want to know when to look for the Avowed, Indy deepdives etc.",0
BurzyGuerrero,3,God damn Xbox Game Pass subscribers are eating over the next couple years.,0
maba_sehiko,3,huge improvement from last year. i was kinda expecting some shadow drop but dragon age releasing this year is hype.,0
geraltoffvkingrivia,3,"I don’t have an Xbox but I’m a pc player. This showcase was everything I thought game fest would be lol can’t wait to hop into dragon age, fable, new life is strange and Indian jones. That was only some of them! Almost every game shown caught my interest.",0
3kpk3,3,"MSFS 2024 blew me away as expected. Perfect Dark, Fable, Stalker 2, Gears of War E-Day, 33 something etc were something else too. Go Xbox!",0
kinggeorgetheiv,3,"Really strong batch of games and trailers. A LOT of fantasy. I was constantly thinking “ohhh this is fable.. no.. oh THIS is fable..”. not that i mind, these fantasy titles look super nice and the genre/world type takes full advantage of next gem hardware",0
ReflectionNarrow5418,3,It was awesome,0
Mithrie,3,"I really enjoyed the showcase this year for sure, a lot of games I will keep my eye on for sure.",0
Dangerous-Ostrich364,13,"Disappointed with no news of handheld, updated controller with new digital series x or a new elite series.  Lots of games to look forward to though.",4
WheySoldier,6,"Best video game showcase in a while. Loved almost everything they showed.   Finally, Xbox! It's what we've been waiting for.",0
scole44,6,Avowed honestly was not what I was hoping it was going to be. Looks a little more cartoony than I'd hoped after seeing that great trailer a couple years back. Hope it doesn't turn out bad.,0
Quitsquirrel,9,Hopefully Avowed and Indy make 2024. It was a little worrisome that they didn't have set release dates. Either way both look amazing and can't wait to dive in.  Perfect Dark looks amazing and I can't wait for that either!,2
Blitzindamorning,13,"Pros/likes: Doom, Avowed, BO6, Perfect Dark, Indiana Jones, Atom Fall, MGS Delta, and STALKER  Cons/dislikes: Oddly placed games (Winter Burrow and WoW), Flight Sim again, and no older AB games on Gamepass.  Also, all those ""insiders"" are full of crock.",3
konanorigami,4,Diablo and elder scrolls got me! What an amazing showcase!,0
Worldly_Fuel6483,4,"State Of Play & Game Fest were pretty awful but this Xbox Showcase was S TIER LEVELS of Kino.  I know there's the joke that this series of modern consoles has No Games but my God it was good. HOWEVER, let us not forget the Devs that have been laid off by Microsoft's Horrible Decisions. Press F To Pay Respects.",0
Jatacus,2,"The emotions I felt when watching that Gears of War trailer… the company needs to lean in to their Gears and Halo roots and what made those titles so special, and anything will be possible for Xbox.",0
Conscious_Abalone_53,2,I thought this was excellent,0
Bleedy_Gonzales,2,"That was a really good showcase, good job Xbox.",0
MentorAjani,2,This was the best Xbox showcase ever!!!,0
foreign_thunder,2,Seeing Fable on this list gives me hope!,0
devilboyvic,2,Avowed and Wuchang look so good.,0
RivalIndigo,2,Gears of War E-Day and Perfect Dark look fire along with Expedition 33,0
BoopsTheSnoot_,2,What a great showcase,0
Think_Land_2584,2,Was bummed no release window or even year for State of Decay 3,0
Unclebanns,2,"Expedition 33, new MGS, Mecha Break, Stalker 2. Most excited about. And of course Gears of War. They going back with GoW actually GOING BACK. Let’s go.",0
AfterAd9996,2,Disappointed to not see OD or anything related to FF but overall great showcase!,0
Unknown_User261,2,It certainly set the standard to beat going forward. I'd just personally tweak it a bit more for nice platform or ecosystem announcements.,0
Pimpimwill,2,"I had low expectations, but they have a solid lineup. I’m actually excited.",0
bills_2,2,"Best showcase I can remember in a long time. Most had dates, tons of variety with several big hitters.",0
DontToewsM3Bro,2,Great show   8/10  Hopefully the games live up to hype,0
Caesar_35,2,"Fantastic showcase with a fantastic Grand Prix right after. What a night!  Indy's my biggest favourite, and Starfield DLC and STALKER. Flintlock, Avowed, South of Midnight, State of Decay, and Fable are also looking great. Atomfall was a nice surprise too. Looks a lot like British Fallout? All those should more than cover my Gamepass subscription for the next couple of years. Bit of Pat Benatar during ESO was a treat too.  Was really hoping for the old CoD's on gamepass (muh MW2 Spec Ops, since I'm always too lazy to change discs) and something for Ara and Elder Scrolls VI - optimistic on that one, I know. Soon for all of them, I hope.",0
JUNiOR8TE,2,BRUH LIFE IS STRANGE GOT ME INCINERATING MY FURNITURE AS I HAVE TURN INTO A BALL OF FIRE,0
evoke3,2,"I haven’t watched anything since I’m still at work, is there the world premiere voice, I need it.",0
Leonemilio,2,"Shameful,whining ,anything Xbox game haters.sums up the chat in that stream. Embarrassing as a gamer.",0
uncsteve53,2,"Looking forward to stalker 2, state of decay 3, perfect dark, and doom. Expedition 33 seems cool. The rest, meh",0
St_Jax,2,Did they say/show anything about Cod Zombies?,0
jenbamin245,2,Was that Jay Cartwright from the Inbetweeners as Humphry in the Fable trailer?!? Bring on 2025!,0
ScottyKNJ,2,We finally fucking made it guys.,0
hulkingbehemoth,2,"Nice to see an actual slew of games to be excited about, it’s refreshing. Especially with how damn good many of them looked?   Here’s to hoping that same quality is there at launch",0
FrozenRage1989,2,I thought overall it was a great showcase..lot of stuff to look forward to. Hopefully once I'm no longer homeless I'll be able to return to gaming. ,0
princeoinkins,2,"Excitied for: Perfect dark   Doom   Metal gear solid   Atomfall (never been on my radar but looks great)  Dissapointed we did see:  Elder scrolls 6   teaser for a new fallout (I didn't expect it, but still want it)   Outer worlds 2 (confimed in devlopment, not sure how long it will take)   halo news (I just want story DLC)",1
flutterdash2,2,"Great showcase, I'd have love to see more info on when Activision games will get on gamepass",0
BerserkFanYep,4,Might be my favorite showcase. I wanted to play like ten of those games. Only slight disappointment was I put my clown makeup on and thought Silksong would finally show 😢,0
SladeX7,4,Absolutely stacked!,0
barnesnoblebooks,2,As REALLY hoping for either WoW on console or MW3 coming to gamepass. I wasn’t disappointed in the presentation but losing hope that WoW will ever come to console,1
PepsiSheep,3,"""Xbox has no games""  ""I can't wait to play this on PS5.""  Which is it?",2
tbear87,4,"Am I the only one that was hoping for more release dates? I thought there'd be more for 2024. I just worry all those 2025s are really going to be 2026 or later...  Also, I really was hoping the rumor that Oblivion remastered was a thing, but ah well. Definitely a good outing for XBox overall. Hopefully they can build on the momentum.",0
PugeHeniss,4,No Viva Piñata means automatic disappointment from me.,0
rick_rolled_you,2,"Great show, can’t believe all the gamepass day me games, but I’m so sad there was no handheld announcement 😭😭😭😭",0
boop1234567,2,"This showcase was incredible! There were like 15 announcements that got me hyped but mgs, state of decay, perfect dark, the diablo expansion, the new assassins creed game, dragon age, and age of mythology were my favorite!",0
Aggravating-Dot132,2,"Doom, Starfield dlc and update, Perfect Dark, Avowed, Atomfall, Indiana Jones.   Don't have time for other games=\",0
TR1CL0PS,2,That was a great showcase. One of the best Xbox has ever done imo.,0
ShelterMotor,2,"All I know is getting a Series X was well more than worth it at this point for me. Almost ALL the games interested me. Was looking to upgrade to a PS5 pro,  but now? Nah...nothing is interesting me on that platform. (Never a GTA fan)  I'm content. How about you?",1
KidGoku1,1,The only disappointing thing about this showcase was no ABK specifically COD game released on gamepass today. Was really hoping for any black ops game to drop in gamepass today so i could play zombies with my friends.,1
ciemnymetal,1,"Damn, i wasnt expecting much but im blown away. Everything looks amazing!! The only downside is no release dates on most of the reveals but im guessing 2025?",0
DaCoolNamesWereTaken,1,"Would love to see a list of the games with release dates, felt like so many were 2025 ",0
Ravioli_hunters,1,"Plenty of good looking games, but none of them were really for me except Perfect Dark. I was hoping for a bit more.",0
Internal-Version-845,1,A very good show no doubt. Only wished for more dates. Not really sold on Dragon Age yet. They are trying to hard to make it hip I guess. We will just have to see with the upcoming updates. New Gears trailer with Mad world theme in the background was a very nice touch.,1
HIVnotAdeathSentence,1,"Was pretty great presentation, I'm just annoyed that Xbox or YouTube seems to have forced a sign-in for the presentation and most of the videos that are now uploaded.",0
sakr95,1,Any news on next Forza game?,0
EnvironmentIcy4116,1,"No Overwatch 2 news, not even a trailer for the new season. Bad bad sign",0
surfaceVisuals,1,i think they're finally done with blu-ray drives lmao,0
Chicken65,1,Why would anyone get the Series X Digital (white)? I’m bummed because I usually wait for the mid gen refresh to enter into a console generation because you either get a lower price or a small upgrade somehow. But the Series X All Digital is $50 MORE than the Series X original which is on sale right now AND it has less features (no disc drive). Am I missing something? Should I just get the original Series X on sale or is there another reason to get the Series X digital?,1
RespectibleCabbage,1,"Pretty good showcase overall, but then no Silksong so it was all for nothing. Nothing I tell you!",0
Proper_Ad_1216,1,Borderlands 4 ?,0
XuX24,1,"South of midnight looks so good and perfect dark uff that game was one of those memorable games from my childhood, was like the sequel that goldeneye never got I wish they deliver.",0
Guido01,1,Anyone else see the WoW ad and thought we were getting it for consoles?,0
evlampi,1,Fable and Avowed trailers switched my mood from don't care to would play right now.,0
RadRhubarb00,1,They crushed it! 10/10,0
Danvanmarvellfan,1,There is something off about fable. I want to love it but I have a feeling it’s going to be a dud. I want to be wrong so bad. Same thing with perfect dark it’s giving me cyberpunk vibes where it looks almost too good to be real,0
XXMAVR1KXX,1,"I liked it, but I was really hoping for towerborne release date. Hell, towerborne wasnt even in the show.",0
OfficialDCShepard,1,[My friend and I loved the Showcase](https://youtu.be/fsgF_Xx6GLI?si=jekIBdSKLG_J8jL8) but the layoffs still left a bad taste in our mouths overall…I guess we’ll see how they execute here.,0
Mundane-Telephone516,1,2024 play as a female or play doom,0
SonChavy,2,Was it just me or did I not hear the manly “EXCLUSIVE” this time around?,1
MoewCP,1,So is that rumored new controller and console redesign not happening anymore?,1
BitterPackersFan,1,Tons of Stuff shown and a ton of it for 2024 and 2025.   Awesome show!,0
Bolt_995,1,"A very, very well done show, with great showcases for DOOM: The Dark Ages, Perfect Dark, Fable and Gears of War: E-Day. Gave me almost Sony E3 2016 vibes.   Now I hope they all deliver in a massive way. I’m atleast fully confident about DOOM.  The 3 new hardware reveals were surprising and underwhelming. I was expecting the new Sebile controller and the 2TB all-digital cylindrical Series X that were leaked, but I guess they never went ahead with both internally. Instead we get a 1TB all-digital white Series X, a 1TB white Series S and a 2TB black Series X.",0
Theycallmeslickz,1,9/10 for me. A lot to be excited about.,0
Nuo_Vibro,1,definitely an A- showcase,0
Codeman0077,1,Anyone else disappointed to see no gears collection?,0
According_Estate6772,1,Best showcase in years and 2024 has gone from a desert to stacked. Bye bye winter (and possibly spring).,0
MedicusAthleticus,1,I was just about to cancel game pass too,1
Bored_Gamer73,1,People still whining about old ass Activision games not being dropped on gamepass.,0
Alutta,1,On one hand I was kinda disappointed with the lack of release dates but with the new college football game coming out next month I feel like I'm gonna be busy anyway.,0
Plenty-Bullfrog5112,1,Wow Xbox is finally making games again,0
None,1,[removed],1
REPTILEOFBLOOD,-2,Seems like JRPG fans and people who like Japanese games didn't get jack shit,3
RobertdBanks,-2,"Man, I wish they would have had a few games with female leads. I’m disappointed that only 12/15 games had a female lead. Lmao.",1
The-Document-Doctor,-13,"- No Halo news - No Bethesda remasters of E.S or Fallout titles - No ABK games on gamepass - No release dates on 2024 titles - No details on Fable besides a release year - No D4 Expansion details - Randomly plopping WoW into the showcase but no console announcement - 2/3 of the showcase is filler games that will only find an audience due to gamepass - yearly check-in to let you know ESO still exists  What are we even doing here? I love xbox, but this ain’t it. 5/10.",1
diskape,0,"Fantastic lineup. I think everyone will find at least one title for themselves. I see 5-6 must plays for me.  Fable, Perfect Dark, Expedition 33, Doom, Gears of War, Avowed are the ones I’ll definitely check out.",1
Squishymate1121,0,Is anyone else a bit peeved about the fact that they pretty much held back on giving the first gen of series consoles more storage just so they can sell “new” editions down the track. I have a series s and seeing the Bo 6 is gonna take up all my storage isn’t very fun,1
darksandman1118,-1,"I always get my hopes up, always let down  Excited for gears though.",0
PikachuAndLechonk,-1,So is the Xbox with a disc drive now considered a “special edition”?,2
Tomd0m,-1,Another year and not a single whisper of eldar scrolls 6.,2
MacChickqun,-1,Alot of CGI but overall Im really satisfied what was showed. 2025 release  dates for alot of games doesn't bother me either since my backlog is big enough. 🙂,0
UnknownXavier,-32,No forza horizon 6  No announcement of cod games onto game pass  A fail of a showcase to me,3
Trickybuz93,-2,Kinda weird games like Perfect Dark and Gears don’t list platform…,0
CommanderBondd,-10,Very disappointing if you ask me.,2
AnonymousBayraktar,-4,"""coming in 2025""  Yep, I feel like the cool shit is coming next year has been what we've been told since the 360 days.   I can't believe it's been like 6 years since we were first shown Perfect Dark, Fable and Avowed and they STILL don't have concrete release dates.   I also think they should've dropped the Series S. How do you show off a new Series X when you're just handcuffing people who buy it because of the Series S?",1
AutoModerator,0," /u/Xbox-Moderator - This message is posted to all new submissions to r/Xbox; please do not message the moderators about it.    **A reminder that there are new rules in r/Xbox** including **No Tech Support posts.** A full list of rules is available on the sidebar of the subreddit, or [clicking here](https://www.reddit.com/r/Xbox/wiki/rules/).    You can help us by reporting rule-breaking content by using the Report button. We review 100% of the reports.    Questions about subreddit rules? Send us a modmail [clicking here](https://www.reddit.com/message/compose/?to=/r/Xbox).    *I am a bot, and this action was performed automatically. Please [contact the moderators of this subreddit](/message/compose/?to=/r/xbox) if you have any questions or concerns.*",0
darkpassenger9,0,Kinda sad that we got 3 new console SKUs and none of them is a handheld. Guess I’m holding on to my Asus Ally a bit longer.,1
Duramajin,-7,A bunch of trailers for games that probably won't be out until 2026 yet their 19 trillion dollar acquisition of Activision sits dormant. Xbox has lost the plot.,0
WhyHelloFellowKids,-5,"Good show because of all the work in the last 3-5 years, now that they've laid a ton of people off and probably killed morale 3-5 years from now will be a shit show.",0
Secure_Listen_964,-4,Is it just me or are most games the exact same thing with a slightly different story now?,0
Roger_Maxon76,-1,The dragon age trailer was dogshit. I hope it doesn’t reflect the tone of the game,0
Existing365Chocolate,-1,"The more I think about it the more the showcase kind of sucked and was more of the same from Xbox  Lots of cool CGI, minimal gameplay, and almost no release dates (not even the few 2024 games even had a season or month…and it’s fucking June already)  2026 will surely be the year this time, for real",0
sneedschucking,-23,Really light on the exclusives.,2
